,Datetime,Tweet Id,Text,Username,Like Count,Display Name,Language
492,2021-02-02 23:40:21+00:00,1356749328828760065,The health secretary says the government's working with Covid-19 vaccine providers to quickly tackle new variants. https://t.co/3ufRUgdI8s,Jackie_News,0,Radio Jackie News,en
493,2021-02-02 23:40:21+00:00,1356749328220643332,Covid as we have seen is a mutating virus. If you allow this situation of proving you were vaccinated then you will be getting a yearly Covid Vaccine.(Yearly flu shot they can't make that a law),cagle06,0,Bald Fat White Guy & Squire of Gothos!,en
494,2021-02-02 23:40:19+00:00,1356749319148363782,"I'd like to know if you have gotten your Covid vaccine, if yes, I'd like to know where you live.",PhillipLashley4,5,Phillip Lashley,en
495,2021-02-02 23:40:14+00:00,1356749298323619840,"@wierdduk @telegraaf Als de gemiddelde levensverwachting 72.66 (Rusland) is, dan is elk onzin/placebo vaccine een geweldig middel tegen COVID-19.  👍👍 https://t.co/bb1W6Bye7G",Gefira_org,1,Gefira Foundation,nl
496,2021-02-02 23:40:13+00:00,1356749294418583552,"@MrTPSM Yeah, if deaths are high. It seems crazy to say, but if the vaccines are 95% effective, we're looking at a world where very very few people could be dying from Covid. So does every restriction stay in place?

Just speculating.",EntStrategyGuy,0,The Entertainment Strategy Guy,en
497,2021-02-02 23:40:12+00:00,1356749288777412608,@SandraWeeden @werrylettuce If you die of a heart attack within 28 day's of a positive covid test it was covid. If you die within 28 day's of the vaccine it was a heart attack.,Djevans71,42,David Evans,en
498,2021-02-02 23:40:10+00:00,1356749279336013827,@George_Friedman There is a big difference. Banning knives doesn’t hurt the bottom line. Banning fevers does. I think we’ll be back to some kind of pre COVID norm within a year. The vaccine industry is hitting grand slams.,chrome_delete,2,Dr. Chrome Pilled,en
499,2021-02-02 23:40:09+00:00,1356749275590516738,@GovRonDeSantis why was Publix given the contract to give the COVID vaccines? Why not CVS or Walgreens?,happymartie1,0,Happymartie,en
500,2021-02-02 23:40:07+00:00,1356749269449940992,Genesis HealthCare Announces Resident and Staff COVID-19 Vaccine Acceptance Rates  https://t.co/zQCI7R3WRe,CrweWorld,0,Crwe World,en
501,2021-02-02 23:40:04+00:00,1356749257760509953,How do the leading COVID-19 vaccines work? &lt;cite&gt;Science&lt;/cite&gt; explains https://t.co/wBL5amWXsm,Koaowner,0,Ward Hinds,en
502,2021-02-02 23:40:04+00:00,1356749257362051072,Puzzled by the bizarre unification of press headlines saying that (the extraordinary) Tom Moore didn’t have a covid vaccine because of pneumonia medication. The BLF says ‘There is no reason to think the vaccination interacts with any medications.’ https://t.co/AVNowakXEQ,MasterSRooks,0,Sebastian Rooks,en
503,2021-02-02 23:40:04+00:00,1356749256468680705,Can you report on Sweden announcing they are banning giving the Oxford Astra Zeneca vaccine for Covid to people over 65? https://t.co/8U0HYaRf8x,keithtordoffMBE,0,Keith Tordoff MBE,en
504,2021-02-02 23:40:04+00:00,1356749255357177856,All online appointments for the vaccine have been filled. Please stay informed of vaccine availability on our COVID-19 Vaccine webpage https://t.co/neU91Hf6IM #COVIDVACCINE #COVID19 https://t.co/6n9pd7JWx2,BrazoriaCounty,2,Brazoria County,en
505,2021-02-02 23:40:03+00:00,1356749253771751433,Tennessee expects an increase in COVID-19 vaccine shipments from the federal government.  https://t.co/edbxEil5iT,aligerb,1,Alison Gerber,en
506,2021-02-02 23:40:03+00:00,1356749250093342723,"😱Here's 19 Reasons I Won’t Be Getting a COVID Vaccination...

https://t.co/9F04zvUkdX

#Covid #COVIDー19 #vaccination #vaccine #GreatReset #NewWorldOrder #MARK #markofthebeast https://t.co/0afRfMpcHC",WickedPrepping,0,Wicked Prepping,en
507,2021-02-02 23:40:02+00:00,1356749249749405696,"The Biden administration has announced it will begin shipping about 1 million COVID-19 vaccine doses per week directly to thousands of pharmacies around the U.S.

https://t.co/KDEN7u8z1I",kgounews,1,KGOU News,en
508,2021-02-02 23:40:01+00:00,1356749242778451968,"@LuckyDie007 @BBCWorld ""Hopefully the Covid vaccines will continue to work even though it has mutated a few times""

Yes, they don't seem concerned that it won't. Alarmist headline, if you ask me.",Nhamtn,0,Neil Hamilton,en
509,2021-02-02 23:40:00+00:00,1356749238684823552,COVID-19 vaccine sites in Texas can now be found with a quick Google search. https://t.co/rvPLyJBoTm,ksatnews,5,KSAT 12,en
510,2021-02-02 23:40:00+00:00,1356749238210760704,"South Carolina is ""days or weeks away"" from expanding COVID-19 vaccine eligibility to people aged 65 and older, DHEC director says

https://t.co/uutGO0TdTb",ABCNews4,0,ABC News 4,en
511,2021-02-02 23:39:52+00:00,1356749204056666112,Me RN trying to see where my Wayfair order is and trying to get an appointment for my second COVID vaccine dose with @JOCOHealth. https://t.co/oGUjup61LI,MandiePandie13,1,Amanda 🐼,en
512,2021-02-02 23:39:45+00:00,1356749177234014212,"Below is a list of all Covid-19 vaccines that have reached trials in humans, along with a selection of promising vaccines being tested in animals.ปรึกษา ทนายเชียงใหม่ ฟรี 081-9511100 ""ดร.เกียรติศักดิ์ ทนายวิถีพุทธ""  และทีม ทนายความเชียงใหม่ #ทนายเชียงใหม่อาสาช่วยท่านด้วยใจ",legal_mai,0,ทนายเชียงใหม่ ปรึกษาฟรี 081-9511100 ดร.เกียรติศักด,en
513,2021-02-02 23:39:41+00:00,1356749159915732995,I hate when my grandma decides to watch the news cause all you hear is covid this covid that VACCINE!! like we get it,palemami,1,S,en
514,2021-02-02 23:39:40+00:00,1356749156925210625,The Stand | The Truth About the COVID-19 Vaccine https://t.co/6Wq753RmEl,RSB103541288,1,RSB1,en
515,2021-02-02 23:39:37+00:00,1356749143251771394,"$TNXP back above $1 big accumulation between $.90 and $1 because they can bring the vaccine that can put an end to covid-19. Beside they have promising fibro drug and some other interesting pipeline. So regardless vaccine, this has potential. could be your next $nvax",Hemant0116,6,Hemant01,en
516,2021-02-02 23:39:33+00:00,1356749127984496640,"Where To Get A COVID-19 Vaccine In The Chicago Area @cbschicago 
https://t.co/qX81khkPNn",MeganHickeyTV,1,Megan Hickey,en
517,2021-02-02 23:39:28+00:00,1356749104211251203,"Researchers are currently testing 67 Covid-19 vaccines in clinical trials on humans, and 20 have reached the final stages of testing. ปรึกษา ทนายเชียงใหม่ ฟรี 081-9511100 ""ดร.เกียรติศักดิ์ ทนายวิถีพุทธ""  และทีม ทนายความเชียงใหม่ #ทนายเชียงใหม่อาสาช่วยท่านด้วยใจ #ทนายเชียงใหม่",legal_mai,0,ทนายเชียงใหม่ ปรึกษาฟรี 081-9511100 ดร.เกียรติศักด,und
518,2021-02-02 23:39:28+00:00,1356749103267368960,"@TobinCAN @jkenney Why would Providence in Calgary who is in clinical trials with their covid Vaccine be told, ""No Thanks"" by the Canadian Govt?",ldgreen113,0,Lana Green,en
519,2021-02-02 23:39:27+00:00,1356749102516641792,"@UPS CEO on COVID-19 Vaccine distribution: ""We have shipped 225,000 vaccine shipments, that's 36.5 M vaccine doses delivered at a 99.99% service level""

Vaccinations are now exceeding total cases of #COVIDー19 infections

A President with a plan @POTUS @SpeakerPelosi @SenSchumer",MdFacep,0,"Elias Said, MD, FACEP",en
520,2021-02-02 23:39:26+00:00,1356749096820891648,Putnam County Health Department to hold COVID-19 vaccine clinic https://t.co/FSz53ztiYJ,KTTNRadio,0,KTTN ᅠᅠᅠᅠᅠᅠᅠᅠᅠᅠᅠᅠᅠᅠᅠᅠᅠᅠᅠᅠᅠᅠᅠᅠᅠᅠᅠᅠᅠᅠᅠᅠᅠᅠᅠᅠᅠᅠᅠᅠᅠᅠᅠ,en
521,2021-02-02 23:39:25+00:00,1356749093024845824,I JUST started working at a dispensary and because I’m an essential worker I was able to get my Covid vaccine earlier than anticipated! So this is your PSA to keep blazing it up my friends. #SMOKEWEEDEVERYDAY.,Carly_Cam,2,כɐrly,en
522,2021-02-02 23:39:16+00:00,1356749056391970817,"Harris: There's less COVId-19 testing happening right now. The focus seems to be on vaccines. 

People still need to be tested so they don't expose others, she says.",AlisonKuznitz,1,Alison Kuznitz,en
523,2021-02-02 23:39:10+00:00,1356749029166751744,CVS says it will start giving out COVID vaccines in some N.J. stores next week https://t.co/sfF3qFn9ZX,Polish333,1,Pat,en
524,2021-02-02 23:39:07+00:00,1356749017045204999,What you need to know about the COVID Vaccine - Everly Report 2021 https://t.co/eqMgy9SMuL,498Honeybadger,1,HoneyBadger_498,en
525,2021-02-02 23:39:03+00:00,1356749001266253826,News: The Lancet: Study reports preliminary efficacy and safety results from interim analysis of Russian COVID-19 phase 3 vaccine trial - https://t.co/Xt99VDkb4L,7thSpaceCom,0,7thSpace Interactive,en
526,2021-02-02 23:39:01+00:00,1356748993687150594,Got my second dose of my COVID vaccine and my arm feels like it’s going to fall off 😩,madipaige019,2,Madison Hatfield🦦,en
527,2021-02-02 23:39:01+00:00,1356748990197469186,"More than 5,000 COVID vaccine appointment were canceled last week at Kaiser Permanente facilities in Santa Clara County after the provider said it didn't receive the expected doses of the vaccine. https://t.co/dEUevCejsH",KPIXtv,1,KPIX 5,en
528,2021-02-02 23:38:59+00:00,1356748984291835904,"#CovidVaccine 

Tamil Nadu conservancy worker dies days after receiving COVID-19 vaccine jab
“The deceased’s family members staged a sit-in protest at the hospital, seeking a postmortem examination by a special team of doctors.”
https://t.co/tTRGMDWUmM",welosthim,1,Elizabeth,en
529,2021-02-02 23:38:58+00:00,1356748981112623105,"@POTUS ""Help is on the way.""
I'm waiting for a #CovidVaccine @POTUS
I DON'T want to end up in the #COVID19 death count, on @CNN
We need MASS VACCINATION SITES. 🇺🇸
WE CAN'T GET VACCINES at @Walgreens @cvspharmacy
ONLY WHITE PEOPLE CAN.
#BlackLivesMatter

@NewDay @jaketapper 
@RonaldKlain",jenniferclmn,0,Jennifer Coleman,en
530,2021-02-02 23:38:52+00:00,1356748953597919233,My parents finally got their 1st dose of the covid 19 vaccine! Life is good!!,lindar2152,0,lindy-lou,en
531,2021-02-02 23:38:52+00:00,1356748953149136902,WSBTV Why are you reporting that the #covidvaccine has  reduced  infection recently  when GA has NOT widely  administered the 2nd dosage and waited thereafter. Plus GA has only given 954K doses compared to millions impacted @TomJonesWSBTV @WSBTVNewsdesk @JovitaMoore #CovidVaccine,JeffersonandCo,0,African American Juvenile Justice Project,en
532,2021-02-02 23:38:50+00:00,1356748945909776389,"1. We've lost superstar staff &amp; community site PI across partnership
2. A founding partner, Health Department is busy leading COVID testing, contact tracing, vaccines. 
3. Stakeholder Advisory Board has experienced major life changes. 
How do I/we get through this?😰2/6 https://t.co/szRMDgWxnx",NammiKan,4,namratha kandula,en
533,2021-02-02 23:38:49+00:00,1356748941241561091,"About 32.8 million Covid-19 vaccine doses administered in the US, new CDC data shows https://t.co/SNysfee9pH",newstimebarak,0,NEWS TIME BARAK,en
534,2021-02-02 23:38:48+00:00,1356748936896217093,Scheduled my first Covid vaccine near the Trader Joe’s because she’s a millennial,lindsayfloraa,0,Lindsay Flora,en
535,2021-02-02 23:38:46+00:00,1356748927803002882,"ppl I love are starting to get their covid vaccines, I love that",peachbluntwrap,12,pilot jones,en
536,2021-02-02 23:38:43+00:00,1356748916474134528,Received the second dose of the Covid vaccine. My arm is so incredibly sore.,tinynosferatu,0,Becca ;),en
537,2021-02-02 23:38:42+00:00,1356748911533154306,@WellsFargo I’m talk trying to follow up on a claim I was on hold for 45 minutes to days in a row I cannot continue to be on hold as I am attempting to get my Covid vaccine appointment please have someone call me,kemnjca,0,Kathleen Maher,en
538,2021-02-02 23:38:41+00:00,1356748907930345474,"In all seriousness though

My 2nd Covid Vaccine tomorrow afternoon and I am beyond excited!!!",Sorry_Tag,2,SorryTag,en
539,2021-02-02 23:38:39+00:00,1356748900196040706,"COVID-19 Vaccine Doses Administered
🔸472,655 People Immunized with One Dose
🔸140,189 People Immunized with Two Doses
🔸613,294 Cumulative Doses Administered

Find more information about vaccination data: https://t.co/ESjOxUidDl 

#COVID19Colorado https://t.co/t3hl9rilc2",COEmergency,4,CO - Emergency Mgmt,en
540,2021-02-02 23:38:38+00:00,1356748896765149184,Health officials deny Covid vaccine led to death of worker https://t.co/Oar1j5na6V,TOIMadurai,0,TOI Madurai,en
541,2021-02-02 23:38:31+00:00,1356748865832185856,scheduled my covid vaccine 😎,choifulsun,8,_shuaaa⁶⁶ ☾,en
542,2021-02-02 23:38:30+00:00,1356748860832456705,"@KieserBill Because it is in Montreal!
COVID vaccine solution was here in Calgary while Trudeau looked to China
We asked for $35M
Had we gotten that we wouldn't be starting Phase 1 right now, we would be in Phase 3', Brad Sorenson, CEO of Providence Therapeutics
https://t.co/i26yWBdZEW",CRC57325971,1,CRC,en
543,2021-02-02 23:38:29+00:00,1356748857133191168,Biden administration will ship COVID-19 vaccines directly to pharmacies - NPR https://t.co/2gZHXAiFHK,ev3ponies,0,Ethlyn Vogler,en
544,2021-02-02 23:38:29+00:00,1356748855585329152,How a Native American COVID-19 vaccine rollout is a model for community-centered approaches | The Seattle Times https://t.co/JDvjVnYBiZ,anarcho,0,anarcho,en
545,2021-02-02 23:38:24+00:00,1356748835331186695,"What? What do I do now?
Pfizer's COVID-19 vaccine less effective against South African variant - The Jerusalem Post https://t.co/4jfI6NflPw",SteveLudwick1,0,Steve Ludwick,en
546,2021-02-02 23:38:23+00:00,1356748832747446277,"@DrTomFrieden What we should do now?
What we should do is what we should have done 11 months ago, but @BorisJohnson bottled it.
All hope is on the vaccine but with new mutations happening every day we don't even know if the vaccines will work.
The only way was a zero covid way...........",jersjustaskin,3,Jer's just askin' 🇪🇺🇵🇸,en
547,2021-02-02 23:38:23+00:00,1356748830834851841,@doriantaylor the gates foundation has actually fucked with the covid vaccine supply which is objectively worse bc how many brains can elon break,amyhoy,0,Amy Hoy,en
548,2021-02-02 23:38:22+00:00,1356748827160678407,"@CNN It’s all unknown right now,the science is saying you need the 2nd dose of vaccine within 3-6 wks to acquire immunity from the South African variant,the uk government say it’s ok to wait 12 wk ! Even if you’ve had Covid you can still contract the South African variant !!",glynnyboo,0,Glyn Sanders 💙,en
549,2021-02-02 23:38:20+00:00,1356748819388653568,👍 on @YouTube: How The COVID-19 Vaccine Could Lead To A Cure For Cancer | Answers With Joe https://t.co/3m0J6rqbpi,MonteLetourneau,1,monte letourneau,en
550,2021-02-02 23:38:18+00:00,1356748812212187137,Called my auto insurance helpline for some questions I had w my policy. Offered to chat with the person on the other end of the line if they had questions about covid/vaccine. Turns out their daughter is finishing up residency &amp; is a frontline worker. I spoke to a proud parent!,IDdocAdi,148,Adi,en
551,2021-02-02 23:38:17+00:00,1356748806893625344,COVID-19 Vaccine Update: HHS Expands Pool of Eligible Vaccinators under PREP Act https://t.co/XWC5EnCblw,JDSupra,0,JD Supra,en
552,2021-02-02 23:38:16+00:00,1356748804037476355,Can Vegans Get a COVID-19 Vaccine? https://t.co/deoOqX7CIs,JoanJoan37,0,Joan Beech,en
553,2021-02-02 23:38:15+00:00,1356748800304553984,IM GETTING THE COVID VACCINE,YungChair,9,HunterXHunter stan account,en
554,2021-02-02 23:38:13+00:00,1356748790141759488,@BBCNews Can you report why Sweden have banned giving the Oxford Astra Zeneca Covid vaccine to over 65's ?,keithtordoffMBE,0,Keith Tordoff MBE,en
555,2021-02-02 23:38:12+00:00,1356748787641950208,Post Edited: Lack of internet access prevents some residents from signing up for COVID-19 vaccine https://t.co/uRaSSKOzXG https://t.co/cE0jqMzJjF,4StateNews,0,4StateNews,en
556,2021-02-02 23:38:07+00:00,1356748764350980098,"The Biden administration will begin shipping COVID-19 vaccines to U.S. pharmacies next week, ramping up vaccinations as new and potentially more serious virus strains are appearing, the White House said Tuesday.
https://t.co/Vo65tm64H1",ksannews,0,KSAN News,en
557,2021-02-02 23:38:06+00:00,1356748762228674560,"The Biden administration will begin shipping COVID-19 vaccines to U.S. pharmacies next week, ramping up vaccinations as new and potentially more serious virus strains are appearing, the White House said Tuesday.
https://t.co/Blwk2QKGac",klstnews,0,KLST TV,en
558,2021-02-02 23:38:05+00:00,1356748756356485122,"Coronavirus in Illinois updates: 2,304 new COVID-19 cases and 47 deaths reported as state tops 1 million vaccines administered and suburban Cook County moves to Phase 4 of reopening plan: hi INDiA Here are the latest updates on… https://t.co/wSArXgF6nh | https://t.co/Vhb7EKELqw https://t.co/hyauKXV4JG",hiindia,0,hi INDiA News Media- News updates 24/7,en
559,2021-02-02 23:38:04+00:00,1356748751533203473,"Open SmartNews and read ""Indiana COVID-19 Update: IN expands vaccine eligibility as state reports 1,567 new coronavirus cases, 65 deaths"" here: https://t.co/8GW8tyP1Sj 
To read it on the web, tap here: https://t.co/C3lyDyyzjT",KaratDiamond,0,Q,en
560,2021-02-02 23:38:02+00:00,1356748742834200586,"#Ashland, #Framingham, &amp; #Natick Superintendents and Ashland &amp; Framingham Teachers Unions Want Gov. To Prioritize COVID Vaccine For K-12 Staff https://t.co/dHnx1R7R2F 
@FramTeachAssoc @massteacher @framsuper @AshlandClockers @MassGovernor 
#Masspoli #COVID19Vaccine #Frampoli",FramSource,0,FraminghamSource,en
561,2021-02-02 23:37:59+00:00,1356748732956631040,"While the Biden Administration is still trying to find their azz from their head, the corporate media refusing to hold them accountable for the #CovidVaccine distribution.

Where is the vax?",CalFreedomMom,2,All Lies Will Be Revealed 🇺🇸,en
562,2021-02-02 23:37:59+00:00,1356748730549088258,"If you want the latest information on Chicago's plan to distribute the COVID-19 vaccine to the hardest hit communities, please sign up for this virtual town hall.
 Questions can be submitted in advance to communityengagement@cityofchicago.org https://t.co/3e4aejvBWf",RepSlaughter,0,Justin Slaughter,en
563,2021-02-02 23:37:52+00:00,1356748702686334988,@NJGov can someone please tell me when my 91 year old mother in law can get her Covid vaccine. She lives in Hillsborough and no one has gotten in touch with her! Surely she doesn’t have to wait much longer she’s vulnerable!!,judyilett,0,judeilett,en
564,2021-02-02 23:37:51+00:00,1356748697497927688,"If your loved one is hesitant to get the COVID-19 vaccine, share this https://t.co/qR3NcKtZpK",GoldfinchIowan,0,Vaxxed and Still Masked BECAUSE I CARE,en
565,2021-02-02 23:37:47+00:00,1356748682897588224,Genesis HealthCare Announces Resident and Staff COVID-19 Vaccine Acceptance Rates $GEN https://t.co/dHKzHBMKyH,newsfilterio,0,Investor News,en
566,2021-02-02 23:37:44+00:00,1356748668523716609,"Wait... then who implanted chips in the covid vaccine? /s

If I'm gonna get a govt tracking chip, I at least want it to be made by Elon Musk. I want a refund on my covod vaccine. https://t.co/ixicO8ysSh",masteryodaiv,0,Yode 🇺🇲🇺🇲🇺🇲🇺🇸🇺🇸🇺🇸,en
567,2021-02-02 23:37:42+00:00,1356748659094872069,Further analysis finds Oxford-AstraZeneca COVID-19 vaccine 76 percent effective 3 months after first shot https://t.co/ng5COme6ks via @YahooNews,maderazo_jake,0,jakejmaderazo,en
568,2021-02-02 23:37:35+00:00,1356748630007271424,"People who ignore distribution protocols for Covid-19 vaccines and jump in line: scumbags or ""just looking out for  #1"" since no one is really checking?",DhivaMarie,0,Dheevs,en
569,2021-02-02 23:37:34+00:00,1356748626375151620,"Biden Admin Has 'Lost' 20 Million Doses of COVID-19 Vaccine-
https://t.co/rPs8dXoGwi
Via - @NeonNettle
#NeonNettle",DavidSm87576302,0,David Smith,en
570,2021-02-02 23:37:33+00:00,1356748621081960450,"2nd dose of the covid vaccine went well with no complications.I can feel it working 💯 #GetVaccinated 
@CDCgov @WHO https://t.co/9fgSCx3ZHU",lenora_philson,0,Lenora⭐(👑💙😷💐)⭐,en
571,2021-02-02 23:37:32+00:00,1356748619760627712,"The question isn’t. ‘Have we lied to you?’

It’s ‘Have we ever told you the truth?’

#auspol #FrontOfTheQueue #Covidvaccine #ICAC #Robodebt #SportRorts #RubyPrincess #NBN #StrandedAussies",FearDeptAU,1,"Fear Department, Australia",en
572,2021-02-02 23:37:31+00:00,1356748612361875457,"UK Covid strain mutates again, may be able to evade vaccines 
 https://t.co/9kqmaBmAYz",NZ_FamilyDoctor,1,רופא משפחה בניו זילנד,en
573,2021-02-02 23:37:30+00:00,1356748611753705473,"@melody__raymond @zachheltzel @ashishkjha @NateSilver538 Yeah, vaccines never eliminated measles, mumps and rubella, other viruses. Still we need not to be afraid of them when we go to a restaurant. This is where COVID will be when it's no longer spreading in communities. That's when things will go back to normal.",jupp0r,0,jupp,en
574,2021-02-02 23:37:24+00:00,1356748584671211520,I work in a doctor’s office that only does COVID-19 vaccines and honestly... it’s mentally exhausting dealing with older people.,_ItsMayadee,0,MD.,en
575,2021-02-02 23:37:21+00:00,1356748573090668551,"On Feb. 11, CVS will start vaccinations at 11 CT locations.
Starting Feb. 12, Walgreens will administer COVID-19 vaccines at about 50 stores in CT. 

More on the federal direct-to-pharmacy vaccine roll out and what it means for CT👇
https://t.co/MSi5M16nfo",emiliemunson,5,Emilie Munson,en
576,2021-02-02 23:37:18+00:00,1356748558284775425,"Biden’s administration announced Tuesday that it is moving to expand access to COVID-19 vaccines, freeing up more doses for states and beginning to distribute them to retail pharmacies next week https://t.co/UcKMre4jAy",chicagotribune,24,Chicago Tribune,en
577,2021-02-02 23:37:15+00:00,1356748545890607105,"Some healthcare workers refuse to take COVID-19 vaccine, even with priority access https://t.co/WOFWICMV9k",KrutchEddy,1,Eddy Krutch🍊,en
578,2021-02-02 23:37:14+00:00,1356748541423714304,"People be like: 2 days after the covid vaccine: Feel like I got run over by an 18 wheeler. My body’s in excruciating pain. I’m hypothermic w/ a fever of 107. Haven’t slept in 48hrs, have a migraine worst than a cocaine binge and my doctor said I might die, but it’s all worth it.",mikemagz07,8,Michael Magaletta,en
579,2021-02-02 23:37:11+00:00,1356748532372418561,@Transport_gc @CanadianPM how about Canadians who need to travel to write exams in the EU etc? Are they considered essential travel and exempt from paying $2000? I won’t be travelling to vacation after all. @globalnews @CTVNews #covidtravel #CovidVaccine,gurutraveler,0,The Guru Traveler,en
580,2021-02-02 23:37:08+00:00,1356748516941512707,I got my 1st COVID vaccine today. #ThisIsOurShot,_nurse_steph_,3,LB,en
581,2021-02-02 23:37:08+00:00,1356748516526276610,"How big a leap do you think it will be for Americans to realise the Covid vaccines are socialised medicine?

and then go “wait... maybe... hang on... maybe other healthcare should be free too... 🤯”?",imrankhan,24,Imran Khan,en
582,2021-02-02 23:37:07+00:00,1356748512050962433,"We've received a lot of calls recently from seniors around Colorado Springs struggling to actually find a covid vaccine.

It turns out they were at a disadvantage this whole time.

https://t.co/IgMDIvANj4",AndyMackReports,3,Andrew McMillan,en
583,2021-02-02 23:37:06+00:00,1356748509702197251,"If your loved one is hesitant to get the Covid-19 vaccine, share this https://t.co/u761FUJFua  #JustPlainPolitics",JPPolitics_com,0,Just Plain Politics!,en
584,2021-02-02 23:37:05+00:00,1356748506984144899,"@mekkaokereke Luckily the vaccines seem likely to prevent severe covid, even with the mutations (something about t-cell vs. antibody response, and this matches what happened in the J&amp;J trial)",jackiebo,3,Jackie Bavaro,en
585,2021-02-02 23:37:05+00:00,1356748505377767426,"@jrossibarra @vsbuffalo You can officially give my covid vaccine to athletes, b/c I WANT to die after seeing this thread",jgschraiber,8,Joshua G. Schraiber🌹,en
586,2021-02-02 23:37:04+00:00,1356748502148202498,Lessons Learned from Israel’s Vaccine Rollout - Ontario COVID-19 Science Advisory Table https://t.co/0uh8WZ9tGs,DoronJGold,0,Doron Gold,en
587,2021-02-02 23:37:02+00:00,1356748491796606977,"NEW LOCAL PHARMACY COVID-19 VACCINATION SITE IN SOUTH MODESTO
(please share widely) 
COVID-19 Vaccine now available at Familia Farmacia for eligible populations. Limited supplies. 
Call ahead 209-566-9956 for more info   
1757 Crows Landing Rd, Modesto, CA  
open 9am-6pm Mon-Fri https://t.co/hclnEhSvz4",tonylmadrigal,1,Tony Madrigal,en
588,2021-02-02 23:37:00+00:00,1356748483148005378,"Israel on Monday transferred 2,000 doses of #Moderna #COVID-19 vaccine to the #Palestinian Authority, according to Israel’s Coordinator of Government Activities in the Territories (COGAT).

https://t.co/rN5yXAQkuF",JNS_org,0,Jewish News Syndicate,en
589,2021-02-02 23:36:53+00:00,1356748455956389894,"Sputnik V COVID-19 vaccine candidate appears safe and effective - The Lancet
#AlbertoYCristinatenianrazon https://t.co/hYZst0cB7X",betinau,0,Betina  💚,en
