,Datetime,Tweet Id,Text,Username,Like Count,Display Name,Language
0,2021-02-02 23:59:58+00:00,1356754262525571074,"@TheTorontoSun Because it's Calgary and not Montreal
COVID vaccine solution was here in Calgary - Trudeau looked to China
We never asked for $1B we asked for $35M
Had we gotten that we wouldn't be starting Phase 1 right now, we would be in Phase 3 Providence Therapeutics
https://t.co/i26yWBdZEW",CRC57325971,1,CRC,en
1,2021-02-02 23:59:57+00:00,1356754258096455687,"I do have an issue with all the news stories about the COVID-19 vaccine. Why do we have to keep showing people getting shots?  

I hate shots. You’re not helping.",wgkcss,2,William 🎩 Gentleman Overlord,en
2,2021-02-02 23:59:56+00:00,1356754256531845122,"A survey spearheaded by UST researchers shows a high percentage of respondents worried on COVID-19 vaccines' effects, efficacy, safety, and high cost.

https://t.co/hKtZlaRopS",cnnphilippines,18,CNN Philippines,en
3,2021-02-02 23:59:54+00:00,1356754248046759936,"""Trudeau announces deal to manufacture COVID-19 vaccines in Canada""  https://t.co/Cv5VAtjVug",RemnantVessal,0,Endtime Remnant,en
4,2021-02-02 23:59:53+00:00,1356754241247989764,The PlayStation 5 &amp; covid vaccine roll outs are equally terrible,ceb3_,10,charity,en
5,2021-02-02 23:59:52+00:00,1356754240581087234,"@Andy_In_The_UK WHERE ARE THE GOOD PEOPLE ON TWITTER ? LET’S RETWEET THIS VIDEO and SHARE SHARE SHARE ! 
Dr Vernon Coleman breaks down as he explains the worldwide #genocide taking place with these so called Covid vaccines 
https://t.co/rbTcBlzL3T
#VernonColeman #Covid19",EmpressYudah,2,Yudah Naphtali #BORNFREE,en
6,2021-02-02 23:59:50+00:00,1356754230695104514,"Friday: Sister is fine.
Saturday: Sister gets COVID vaccine.
Sunday: Sister has COVID symptoms.
Monday: Still has COVID symptoms.
Tuesday: Sister tests positive for COVID.

Lol. Can we skip to 2022? 
(Yes, I'm assuming this is a coincidence)",MitchHolland23,0,Mitch Holland,en
7,2021-02-02 23:59:42+00:00,1356754196855463938,"7-
@Vbiruta  also spoke about the Covid-19 vaccine, saying the Commonwealth, could play a key role in ensuring equitable access to and distribution of fairly priced vaccines, using its experience as a leader on environment and climate change that continue to affect communities.",fredkalisa1,0,fred kalisa,en
8,2021-02-02 23:59:39+00:00,1356754185795043331,"Cuomo says NYC, local gov’ts can decide whether restaurant workers, taxi drivers can get COVID vaccine https://t.co/GtCL8uYYdp 
I applaud @NYGovCuomo for opening to more eligible recipients. I ask that we include #clergy. They too sit on the #frontlines of communities of color.",KhariOEdwards,1,Khari O. Edwards,en
9,2021-02-02 23:59:33+00:00,1356754158167052288,Detroit officials working to triple number of COVID-19 vaccines administered https://t.co/jrABJ8YaV4 https://t.co/ijI7582rvh,WCMUNews,0,WCMU Public Radio,en
10,2021-02-02 23:59:32+00:00,1356754154497085440,Experts split on delaying Covid-19 vaccine second doses https://t.co/mByvTKXLcS,swissbusiness,0,swissbusiness,en
11,2021-02-02 23:59:30+00:00,1356754148570640384,Round 2 of my #Moderna vaccine. The only side effect I had after the first injection was a wicked sore arm. Hoping for the best. #COVID #Covid_19 https://t.co/TEhIm3L9yI,HonnyDipp,1,Kisha,en
12,2021-02-02 23:59:29+00:00,1356754143742840832,"Factors that drive herbicide resistance:
-massive numbers
-pest diversity
-poor control
-chemical reliance

The parallels with covid &amp; vaccines are frightening. Surely covid will mutate faster than new vaccines can be rolled out.

Where is the #big6- for covid? #whathavewelearned https://t.co/aaqJOXeJeb",ipaddockapps,10,iMic Fels. Heres to 22,en
13,2021-02-02 23:59:28+00:00,1356754136851566592,"WOW: CDC Data Reports at Least 273 Deaths &amp; 9,845 Adverse Events to COVID-19 Vaccine Thus Far https://t.co/0hpNfq4UI3",VickiLa51069468,0,Vicki Lang,en
14,2021-02-02 23:59:26+00:00,1356754131298312207,I think I’m giving myself a headache from over thinking about the Covid vaccine I just got 💀💀,looops_28,0,loooops🐝,en
15,2021-02-02 23:59:25+00:00,1356754126764408835,"MORE VACCINES: Gov. Andrew Cuomo had some welcome news from the federal government during his COVID-19 briefing Tuesday, announcing that it is increasing its supply of vaccines to states. https://t.co/41oWIhi9Cz",News12WC,3,News12WC,en
16,2021-02-02 23:59:17+00:00,1356754093864349704,"@FloridaGOP @GovRonDeSantis I wonder if some of those @GovRonDeSantis @Publix vaccines will make into the Black neighborhoods? Publix historically have avoided those areas, as has DeSantis, probably not. COVID-19 kills Black folks at a much higher rate that the population. Just asking for a Black guy.",MatthewBParksSr,2,All Might M@,en
17,2021-02-02 23:59:17+00:00,1356754091490344961,"@TCRG2012 @terryjtucker TX if you’re tired of devastating Covid cases having to drive hours to receive a vaccine and wait for hours to get food from a food bank, #VoteTerryTucker for Congress TX03 https://t.co/0T3NOp5uBh",GlamMa202067,0,Allisha,en
18,2021-02-02 23:59:15+00:00,1356754083214934019,"HumanProgress: More than 100 million Covid-19 vaccine doses have been administered worldwide, according to the latest data tracked by Bloomberg. https://t.co/DYyNnk2k31 Good things happening.#fb",tudor_jacob,0,Jacob Tudor,en
19,2021-02-02 23:59:12+00:00,1356754073052184576,"@fordnation COVID-19 the weekend your government had an excuse for vaccine delays,yesterday another, today yet another, tomorrow what next and we still don't have an answer as to when we get ours, are you using Trump's template.",gordonhhi,0,Gordon Cairns,en
20,2021-02-02 23:59:12+00:00,1356754070162268161,"I still have a headache from the effects of the covid vaccine, but aside from the cold I didn't feel anything else, I mean normal pa naman ako .. 🙂",G7SevenSouls,1,Hiautus,en
21,2021-02-02 23:59:12+00:00,1356754069168218113,Further analysis finds Oxford-AstraZeneca COVID-19 vaccine 76 percent effective 3 months after first shot – Yahoo News https://t.co/TGEiLsJire,k29664911,0,Today's news summary,en
22,2021-02-02 23:59:09+00:00,1356754059085152256,"""Despite an announcement Tuesday about his long-term plans to produce COVID-19 vaccines in Canada, Prime Minister Justin Trudeau ended up in the same place he was at the start.""

#BackOffTheLine #TrudeauVaccineFail
 https://t.co/o7StZ73Wml",alphaflight75,0,Dark Canuck,en
23,2021-02-02 23:59:08+00:00,1356754054114914310,"MORE VACCINES: Gov. Andrew Cuomo had some welcome news from the federal government during his COVID-19 briefing Tuesday, announcing that it is increasing its supply of vaccines to states.
https://t.co/1echXKF9Ry",News12HV,0,News12HV,en
24,2021-02-02 23:59:08+00:00,1356754053196308484,"Latinx COVID Deaths Rise by 1,000 Percent in Los Angeles as Vaccine Rollout Lags https://t.co/9knTOfVvg4 via @truthout",Spanishcountry,0,Teresa MASIA PERALES,en
25,2021-02-02 23:59:07+00:00,1356754050537066496,"@kantei_vaccine - confirmed COVID-19 illness in people (who) without evidence of previous infection. 
“感染前の人”を除外した、『COVID-19』を“発症していると確認された人々”に於いて。",feijoa_hal,0,ashworth,ja
26,2021-02-02 23:59:07+00:00,1356754050188984320,The Biden administration has announced that it will begin shipping about 1 million COVID-19 vaccine doses a week directly to thousands of pharmacies in an attempt to address equity concerns and speed up the country's crucial inoculation effort. https://t.co/wT8bXfANZq,tempkenalt,0,tempkenalt,en
27,2021-02-02 23:59:06+00:00,1356754044929335299,"Russian scientists say country's Sputnik V vaccine appears safe, effective against COVID-19 https://t.co/RQ1sJTWEuZ",WPBF25News,1,WPBF 25 News,en
28,2021-02-02 23:59:06+00:00,1356754044673347586,"@ChildrensHD Straight from the CDC: “While more is learned every day about COVID-19 and the virus that causes it, THERE IS STILL A LOT THAT IS UNKNOWN.” So they got a so-called vaccine out in a matter of weeks being experimented on people based on a lot that is still unknown. I registered.",DragonEmbrace,0,Live & let live,en
29,2021-02-02 23:59:02+00:00,1356754029364137986,Getting my first dose of the covid vaccine. 😬,xChrisDuran,1,Chris Duran (Taylor’s Version),en
30,2021-02-02 23:58:58+00:00,1356754011861311493,"COVID-19 Q&amp;A: Vaccine administered vs. distributed, new online resource, new vaccines, and getting vaccinated after COVID https://t.co/e6qcM5SKgW via @IDHW",IDHW,2,DHW,en
31,2021-02-02 23:58:52+00:00,1356753987538722819,"Good evening @GavinNewsom, one way you could slow the spread and fight covid cases and deaths (and ableism) in California is by making sure people with high-risk conditions of ALL ages qualify for the vaccine now—not just older adults! #HighRiskCA",emilybrooks89,128,Emily Brooks,en
32,2021-02-02 23:58:51+00:00,1356753981591048195,I Volunteered To Administer COVID-19 Vaccines. Here’s What I Saw During My Shift. https://t.co/SxJME0BrCL,WholeHogLiving,0,soto,en
33,2021-02-02 23:58:50+00:00,1356753980165079041,"@mmochroi Hello, here is your unroll: SIX successful COVID-19 vaccines! SIX! Three just in the past week! Extraordinary. The newest one is the Russian (Rus)… https://t.co/QNaQIMuPDV Have a good day. 🤖",threadreaderapp,0,Thread Reader App,en
34,2021-02-02 23:58:50+00:00,1356753977501745152,"Feeling super lucky to feel like crap from my second dose of the COVID vaccine. 

HOWMEVER, I found out Talk Show The Game Show is on HBOmax so, good all around. @KarenKilgariff @guybranum https://t.co/v4UkZTyzo0",vannahb4nana,0,savannah,en
35,2021-02-02 23:58:49+00:00,1356753975182315527,half of my job got the covid vaccine &amp; a lot of them ended up in the hospital I’ll be damned if I get that shit!,ManipatriceOx,0,8.12🦋,en
36,2021-02-02 23:58:45+00:00,1356753956068876291,@POTUS Covid- 19    indigenous vaccine made by bachelor of science student Gaurav Singh Rajput from India to combat with covid 19 pandemic it is not fake and rumour .contact number +918874028434 Indian talent made India superpower nation . https://t.co/rEtwMlBASu,GauravS98098645,0,Gaurav Singh,en
37,2021-02-02 23:58:44+00:00,1356753954965749766,"Sad day today, Captain Sir Tom Moore died rest in peace you beautiful soul :(

On the bright side, my uncle is able to get his covid vaccine which is always good!",j3ssica_2004,0,🎗J3ssica_2004,en
38,2021-02-02 23:58:40+00:00,1356753937345437699,"I'm livid that a #COVID19 hoaxer who spent an entire year refusing to wear a mask, social distance, stay home, or believe the COVID death numbers, jumped the vaccine line and has the gall to post about it on Facebook. 🤬",k0na,0,Doug Seyller,en
39,2021-02-02 23:58:35+00:00,1356753915769987072,Got my “ COVID Vaccine 💉 today “ #thankfulformyhusband https://t.co/KosDiik8Ka,gavrimy11,12,Se Feliz,en
40,2021-02-02 23:58:28+00:00,1356753888662020097,"Have questions about #COVID19 resources &amp; the vaccine? We're here to help. Visit https://t.co/NLrCt19i5k to learn about:

➡️ MyTurn COVID-19 vaccine notifications
➡️ Regional Stay Home Order updates
➡️ Small business &amp; employer relief
➡️ Local info &amp; alerts

+ more

#StopTheSurge https://t.co/fwu5qAiseq",ListosCA,7,Listos California,en
41,2021-02-02 23:58:28+00:00,1356753888221798401,"I learned A LOT in this discussion—hope you will enjoy it too. ⁦@libshipwreck⁩ Watch on #Periscope: #213. COVIDCalls 2.2.2021 COVID-19 VACCINES, LAW, AND SOCIETY

https://t.co/MdXDNxTob7",USofDisaster,0,Scott Gabriel Knowles,en
42,2021-02-02 23:58:21+00:00,1356753859142647812,Some complain about early Publix vaccine reservation start time. Damn. Be lucky there is a vaccine for your ass. While I’m out wondering every second weather I’m going to catch COVID trying to make a living. Your bitching for getting up early  https://t.co/9h5I49c1Rr,chrispearce28,0,Chris Pearce,en
43,2021-02-02 23:58:20+00:00,1356753853853663234,"Russia's COVID-19 Vaccine 91.6% Effective, Studies Show https://t.co/6JCRFd4KW0 #coronavirus #vaccine",drummike2012,0,Mike Williams,en
44,2021-02-02 23:58:19+00:00,1356753848069738496,"In 24-hour reversal, Cuomo says restaurant workers now eligible for COVID-19 vaccine https://t.co/pFDeSezdwS",RoyButta,0,Roy A. Butta,en
45,2021-02-02 23:58:14+00:00,1356753828880777216,"What a difference competence makes

Biden administration will start sending Covid vaccines directly to pharmacies as it ups shipments to states https://t.co/cvhIUY1Y62",WMBRAINIAC,0,Judicious Crapaholic,en
46,2021-02-02 23:58:05+00:00,1356753790960099328,"Russian scientists say country's Sputnik V vaccine appears safe, effective against COVID-19 https://t.co/hwhjBDQYLK",KCCINews,3,KCCI News,en
47,2021-02-02 23:58:05+00:00,1356753790549061635,"@radioactivez0r Yes, thank you. You can donate blood after receiving a COVID vaccine as long as you are feeling healthy and meet the regular eligibility requirements.",VitalantCA,0,Vitalant - California,en
48,2021-02-02 23:58:04+00:00,1356753786883067906,"More COVID-19 vaccine doses headed for Tennessee, nursing home vaccinations complete https://t.co/yclieX3phI",VSNTennessee,0,Verdant Square Network TN,en
49,2021-02-02 23:58:04+00:00,1356753786124066816,@TheVicar02 @flicklawson @captaintommoore How much longer do you think a bloody vaccine would have given him?  He died having done something he wanted to do.. Better than sitting in God's bloody waiting room.  Life is to be lived and he did just that. He died from pneumonia not Covid.,Birdie_Rebel,3,Birdie,en
50,2021-02-02 23:57:57+00:00,1356753758529740800,"More people in the US have received one dose of vaccine than have been infected with Covid-19, CDC says
https://t.co/ZgT1kIOTcU",KopaJude,0,Jude Kopa,en
51,2021-02-02 23:57:55+00:00,1356753747666427904,What an honor!  Thank you @RevDrBarber for the great conversation about vaccines and ongoing work to fight COVID. https://t.co/JMeUlXFYOL,DrMandyCohen,402,Mandy Cohen,en
52,2021-02-02 23:57:49+00:00,1356753724945825792,"(STAT+: STAT+ Conversations: A conversation on racial health disparities, Covid-19, and vaccine distribution) https://t.co/0SvIrOyDkG https://t.co/YUQo8LIqLR",Dataemia,0,Mazen M,en
53,2021-02-02 23:57:48+00:00,1356753719224844292,@NYGovCuomo @HRC @AlphonsoDavid There is no Covid 19 vaccine for us ..who have underlined conditions and are senior citizens at Advantage Care 96th street 2nd and 3rd avenues,tceero,1,Terrie Stinson,en
54,2021-02-02 23:57:47+00:00,1356753713046712320,"@JustinTrudeau @GovCanHealth @NRC_CNRC This is great news moving forward and long overdue but doesn’t really get us out of the jam we’re in now with vaccines in scarce supply and new COVID variants upon us. Would love to know the realistic date my 90 year old mother, who lives on her own, can get her vaccine.",LarryCainCanoe,9,Larry Cain,en
55,2021-02-02 23:57:42+00:00,1356753691806732288,@LongeneckerBob No I got two...and I think that is the standard. But definitely seems like clinic staff who previously had COVID got more side effects with the vaccine.,TNradonc,1,c.c.lipscomb,en
56,2021-02-02 23:57:41+00:00,1356753689440964610,I received my dose of the Pfizer COVID-19 vaccine 💉 @ Eastern Virginia Medical School https://t.co/uEsXK4Fw8v,treborniffur,0,Black Lives Matter ✊🏿✊🏾✊🏽✊🏼✊🏻,en
57,2021-02-02 23:57:39+00:00,1356753681602015232,"Today, we congratulate @halawontshutup for her good news: “I had an essay published in Vox about the COVID vaccine in the context of medicalized racism -- particularly, the CIA's fake vaccine campaign in Pakistan. https://t.co/PQmDLwkJyM” #GoodNewsTues https://t.co/SuUW4mGaYO",500wsNYC,4,NYC 500 WomenSci,en
58,2021-02-02 23:57:36+00:00,1356753669702770688,#CovidVaccine #GetVaccinated https://t.co/QBWLQyw8pd,jeniferinidaho,29,Jennifer in Idaho,und
59,2021-02-02 23:57:33+00:00,1356753654666174466,"How the Novavax COVID-19 vaccine differs from those already approved in Canada
https://t.co/Z04sp0lrWQ https://t.co/tZ1AfZEUfg",asimakoaa,0,Anna Asimakopulos,en
60,2021-02-02 23:57:24+00:00,1356753618544840711,"In a 24-hour reversal, NY Gov. Andrew Cuomo said restaurant workers are now eligible for the COVID-19 vaccine. https://t.co/WVMOim7cNu",MarketWatch,23,MarketWatch,en
61,2021-02-02 23:57:23+00:00,1356753615113846787,I Volunteered To Administer COVID-19 Vaccines. Here’s What I Saw During My Shift. https://t.co/agrt29giCU via @Yahoo,gatgman,0,Gregg Toney,en
62,2021-02-02 23:57:21+00:00,1356753606825934848,Coronavirus live news: WHO warns 'vaccine nationalism will spawn new Covid mutations' https://t.co/i8KDbfkvSe,guardian,57,The Guardian,en
63,2021-02-02 23:57:20+00:00,1356753600375005184,Wonder how many Republicans are jumping the lines to get covid vaccine.,jeanetteomo,0,Gertrude Simpson,en
64,2021-02-02 23:57:15+00:00,1356753582167621632,@imEducated There is none. If you go back and watch the press conference they said teachers don’t necessarily need the vaccine because there are procedures put in place that prevent teachers from being exposed to Covid.,its__arj,0,michelle obama 🍍🌻,en
65,2021-02-02 23:57:14+00:00,1356753575460896770,More Little Newtons teachers are rolling up their sleeves for the COVID-19 vaccine. In this interview with @ccxnews CEO and founder @AliseRMcGregor shares the excitement and relief it brings. #vaccine #earlyed #education https://t.co/i7Mi3tWmcs,LittleNewtons,1,LittleNewtons,en
66,2021-02-02 23:57:13+00:00,1356753570171863041,Today I spoke with public health officials at an @EnergyCommerce hearing about the need to pass President Biden's COVID-19 Rescue Plan to support the national effort to get more vaccines into the arms of Americans. https://t.co/FI6je5LRe7,FrankPallone,8,Rep. Frank Pallone,en
67,2021-02-02 23:57:08+00:00,1356753552366964736,CVS To Offer COVID-19 Vaccine At 18 Maryland Pharmacies https://t.co/q1V432KkvN https://t.co/zZ1XL0Jxdn,VSNMaryland,0,Verdant Square Network DC-MD,en
68,2021-02-02 23:57:08+00:00,1356753552350175234,Women may be more worried about COVID-19 vaccines. Experts say addressing their fears is essential. from https://t.co/HxTEnv1D2Z https://t.co/X5J0Op1fAt #Flipboard10forToday via @Flipboard,HamsterRj,0,RJ Hamster,en
69,2021-02-02 23:57:07+00:00,1356753547195523075,University Of Maryland School Of Medicine Study: People Who Survived COVID-19 May Only Need One Dose Of Vaccine https://t.co/Vdyl1mrIjH https://t.co/pvi6DDNQ2J,VSNMaryland,0,Verdant Square Network DC-MD,en
70,2021-02-02 23:57:06+00:00,1356753544280485888,"Ma crise du covid-19 :  

Chopé le COVID-19 : non
Cas contact+quarantaine : non
Travail: télétravail complet
Kilos pris ou perdus : bcp+
Chômage covid : non
Voyage depuis mars 2020 : non
Vacances reportées : oui 😔 
PCR : 0
Vacciné : pas encore https://t.co/iRqOrLiQqn",CarteJpl,0,Gigi 🇧🇪,fr
71,2021-02-02 23:57:06+00:00,1356753543437422599,"Russian scientists say country's Sputnik V vaccine appears safe, effective against COVID-19 https://t.co/JKu1jHYsZU",wyffnews4,1,WYFF News 4,en
72,2021-02-02 23:57:06+00:00,1356753542367870978,"Moderna, Vaccine, COVID-19 Vaccine, Moderna COVID-19 Vaccine - Burbank, California - No side effects other than a slight soreness at injection site and fatigued the next day. SafelyHQ https://t.co/o7tC1BFwn5",safelyhq,0,Safely,en
73,2021-02-02 23:57:05+00:00,1356753540451082241,"Russian scientists say country's Sputnik V vaccine appears safe, effective against COVID-19 https://t.co/yKKZEh9zUl",koat7news,0,KOAT.com,en
74,2021-02-02 23:57:02+00:00,1356753526588772352,"Russia's COVID vaccine 92% effective, even in those over 60 https://t.co/lzKLtOCKoo",SamuelBride,0,"Samuel Bride, MD",en
75,2021-02-02 23:57:02+00:00,1356753525519261696,"As 13 million in US get COVID vaccine, minority uptake uncertain https://t.co/CKWsAVRAoR",SamuelBride,0,"Samuel Bride, MD",en
76,2021-02-02 23:57:01+00:00,1356753522461724672,"Which COVID-19 vaccine are you taking? 
🇺🇸: Pfizer Bio N Tech, Moderna, Novavax, Johnson and Johnson
🇷🇺: Sputnik V 
🇨🇳: SinoPharm
🇬🇧: Oxford AstraZeneca
🇮🇳: Bharat Biotech",ZaraarZ,0,Zaraar Zubair,en
77,2021-02-02 23:57:01+00:00,1356753521434120194,@GovtofPakistan @MoIB_Official @nhsrcofficial @fslsltn @Asad_Umar I would like to know the name of chinese Covid Vaccine like this? Thank you https://t.co/iGRVFOhTOP,AzharBaig20,0,AZHAR BAIG,en
78,2021-02-02 23:56:52+00:00,1356753485635735552,"On @CNBC today, Paul Dickson, Jr., of #Shreveport's Morris &amp; Dickson, on delivering the #CovidVaccine, ""Ramp up the supply. The demand is greater than the supply right now. And the distribution network is not a bottleneck."" https://t.co/bXMt1gMPAx",DanJovicNews,0,Daniel Jovic,en
79,2021-02-02 23:56:52+00:00,1356753484075433996,"Here's why some people test positive after getting a Covid-19 vaccine 
https://t.co/9sc1ZbKcBw",AndreasBoos,0,JustSearchin,en
80,2021-02-02 23:56:51+00:00,1356753480107642887,My smart friends send me covid vaccine trial data all the time that I don’t understand and I just have to smile and nod so they don’t realize I’m an idiot,CALAMITYMELODY,5,mel,en
81,2021-02-02 23:56:51+00:00,1356753478396366849,@thundacat830 @RCSD @OfficialLivePD @theprismahealth @LivePDNation @LTDansCrew I hope you do well with the covid vaccine i know a pharmacy tech that got the covid vaccine and is doing well,LynnScalone,0,Lynn Rogers,en
82,2021-02-02 23:56:46+00:00,1356753460729905158,"Y’all gotta stop posting about when you get the Covid vaccine

I promise we don’t care",cadebjohnson,2,Cade,en
83,2021-02-02 23:56:43+00:00,1356753447169703939,I haven't gotten covid and do not have fear of getting covid.  I would prefer to not get injected with the vaccine.,Prhym8,0,sans sherif,en
84,2021-02-02 23:56:43+00:00,1356753446700019720,Oh Great! My 65 year old Father has been registereng online and calling Cone Health and Guilford County Department of Health! 5000 Thousand Vaccines given today! No one called or emailed my Father! You can Die in North Carolina waiting for your Covid-19 Vaccine Shot!!!! https://t.co/iUof3pF1of,RJP56,1,@Edward Lewis,en
85,2021-02-02 23:56:35+00:00,1356753411820179466,Our physicians discussing COVID immunity and vaccine hesitancy. Stump the ID Specialist! https://t.co/X2STsFE80r,MontMedicine,0,MCMS - Montgomery County Medical Society,en
86,2021-02-02 23:56:34+00:00,1356753406640144385,@GovtofPakistan @MoIB_Official @nhsrcofficial @fslsltn @Asad_Umar I would like to know the name of chinese Covid Vaccine like this? Thank you https://t.co/jGanZPQVBs,AzharBaig20,0,AZHAR BAIG,en
87,2021-02-02 23:56:33+00:00,1356753404937179141,Opinion: COVID-19 vaccine rollout needs a shot of equity from https://t.co/HxTEnv1D2Z https://t.co/9fd4KGevOk #Flipboard10forToday via @Flipboard,HamsterRj,0,RJ Hamster,en
88,2021-02-02 23:56:32+00:00,1356753399358783489,"CVS: 250,000 Covid-19 Vaccine Doses To Become Available In Stores In 11 States Next Week https://t.co/ycYW1b6ArZ",tonyatienza,0,Anthony Atienza,en
89,2021-02-02 23:56:29+00:00,1356753389451939841,The UK government admits that covid vaccines are pointless and offer zero protection https://t.co/WBQcqEXr5d,AElsie2,0,Audrey,en
90,2021-02-02 23:56:23+00:00,1356753362214133762,"Manchester Memorial, Rockville General Cancel All COVID Vaccine Appointments Effective Feb. 4 https://t.co/efb51mn1xx",NBCConnecticut,2,NBC Connecticut,en
91,2021-02-02 23:56:21+00:00,1356753355494862848,"Select CVS Pharmacy locations across California will begin offering COVID-19 vaccines to eligible residents next week, the company said Tuesday.  https://t.co/63rmf0DF7u",MyDesert,4,The Desert Sun,en
92,2021-02-02 23:56:20+00:00,1356753349761097732,"@VinGuptaMD  Thanks to the medical personnel at Harborview where I received my first dose of Covid vaccine.  It was simple, low key, and efficient. Anyone stressing about getting a vaccination, as I was, can rest easy. I'm half way to a safer life.",ballardista,0,Holly Stein,en
93,2021-02-02 23:56:19+00:00,1356753347215306752,Israel Covid vaccine data shows extremely low rate of infections https://t.co/TIXjNnhi4u,JeanneBartram,2,Jasmine the European Cat,en
94,2021-02-02 23:56:14+00:00,1356753324490514434,"TOMORROW
Wed, 2/3 6:00 PM
Rep @HoulahanForPa hosts an info session on #CovidVaccine https://t.co/qTGE1y1rUQ",EasttownDems,1,Easttown Dems,en
95,2021-02-02 23:56:13+00:00,1356753321013506048,Industrialist and Philanthropist John Lumic Releases Must-Have COVID Vaccine https://t.co/QobBRI88g5,sol3news,0,Sol3 News,en
96,2021-02-02 23:56:13+00:00,1356753319075659776,AstraZeneca is likely the next COVID vaccine coming to Canada. What do we know about it? https://t.co/6kOnpnHi2B,screenlately,0,Screenlately,en
97,2021-02-02 23:56:10+00:00,1356753305796374530,"Even with vaccines, we still need treatments for Covid. So what works? https://t.co/SYKIIpmOfL",BasiaDiug,3,Dr Basia,en
98,2021-02-02 23:56:09+00:00,1356753302751334403,People really be thinking getting the vaccine means you won’t get covid anymore. I’m praying for people.,Lulubetz,0,Lulu,en
99,2021-02-02 23:56:06+00:00,1356753292722855936,The covid vaccine is more dangerous than the virus.,ChuckieG16,0,ChuckieG 🟧⬛️,en
100,2021-02-02 23:56:05+00:00,1356753287178027014,"Russian scientists say country's Sputnik V vaccine appears safe, effective against COVID-19 https://t.co/7MnU9N0SaX",WJCLNews,0,WJCL News,en
101,2021-02-02 23:56:05+00:00,1356753286884446212,"Russian scientists say country's Sputnik V vaccine appears safe, effective against COVID-19 https://t.co/Q85rYXERE9",ksbw,0,KSBW Action News 8,en
102,2021-02-02 23:56:05+00:00,1356753285957492737,"Russian scientists say country's Sputnik V vaccine appears safe, effective against COVID-19 https://t.co/hR85S5RURB",WGAL,1,WGAL,en
