,Datetime,Tweet Id,Text,Username,Like Count,Display Name,Language
204,2021-02-02 23:52:00+00:00,1356752258063626241,"COMING UP: A look a how pharmacies plan to help with the vaccine rollout. Plus, where do we stand on additional Covid relief? Join us at 7 p.m. ET on @CNBC! https://t.co/FDeTMENCGN",thenewsoncnbc,37,The News with Shepard Smith,en
205,2021-02-02 23:51:58+00:00,1356752249809158156,"Nashville teacher drives 100 miles to get a COVID vaccine
https://t.co/jEO3hd8NMd",NC5,22,NewsChannel 5,en
206,2021-02-02 23:51:54+00:00,1356752235976359936,"... will be able to use the city COVID hotline to register/set up an appointment by phone.

The plan also included a contingency for folks who are unable to leave their home that allows the Fire Dept/paramedics to do home visits on a case by case basis to administer the vaccine.",KweenBeatrix,12,❤️‍🔥Kween Beatrix,en
207,2021-02-02 23:51:54+00:00,1356752234206404609,"Feds to start sending COVID-19 vaccines to pharmacies 
https://t.co/AxzbS6ln7j KEEP IT.",randy2431,0,randywatson331@hotma,en
208,2021-02-02 23:51:51+00:00,1356752219643801602,"Fabulous editorial in @suntimes today from @louweisbach #AJTBC
Comprehensive testing for COVID-19 — even as vaccines are rolled out — could save hundreds of thousands of lives. https://t.co/oVloJp9kbK via @SunTimes",RobJohnsonNews,2,Rob Johnson,en
209,2021-02-02 23:51:46+00:00,1356752201822031873,"I just saw my first job posting with ""preference given to candidates with the COVID-19 vaccine"" 🤦‍♀️",LtlMissFeminist,4,Little Miss Feminist,en
210,2021-02-02 23:51:46+00:00,1356752201725566976,"As SoCal sees drop in COVID-19 cases, concerns remain over new variants, tight supply of vaccine https://t.co/eL16psFpFx",ABC7,20,ABC7 Eyewitness News,en
211,2021-02-02 23:51:46+00:00,1356752201323012107,I have had enough with the disinformation about the covid vaccine among some of my AA friends. If you don't won't to get it fine but keep your crazy conspiracy theories away from me. You sound like QAnon! Yes I went there! I am getting it when it's my turn.,SmithNelsonLa,3,Nelson Smith,en
212,2021-02-02 23:51:45+00:00,1356752197816442883,"I'm unexpectedly on my way to get a COVID vaccine, because the pharmacy has extra they need to use. I'm weirdly nervous mostly because I don't make impulse decisions like this! I wasn't planning on getting one for several months.",LadieRane,0,MO Girl,en
213,2021-02-02 23:51:45+00:00,1356752194301788160,CVS will start administering COVID-19 vaccines at 70 pharmacies in Texas next week https://t.co/mWmaLftKsT,Frod1221,0,Frances Rodriguez,en
214,2021-02-02 23:51:44+00:00,1356752193630650368,What are the odds I’d be the one to get sick after both covid vaccines. This is just ugly.,MariiiGeneee,0,𝐆𝐄ℕ𝐄𝐕𝐄,en
215,2021-02-02 23:51:44+00:00,1356752192322088963,My brother quit his old job around June to cook ~20k meals per day for Salvation Army in SoCal. He’s the only cook who hasn’t gotten COVID yet. Some of his coworkers almost died. He’s only had 3 days off since December. He’s still waiting on his vaccine appointment. https://t.co/AUPe90PJsd,nataliebaviles,1,Dr. Natalie,en
216,2021-02-02 23:51:40+00:00,1356752177377796096,"@MikeBarrettON Instead of talking about vaccines try talking about therapeutics and if you’re feeling strong enough... bring up how ineffective PCR tests are at determining covid infections. (WHOs words not mine). Do better, your globalist traits are showing. Tisk tisk.",southwestontguy,0,inexplicably missing.,en
217,2021-02-02 23:51:36+00:00,1356752159455408129,"B.C.’s #COVID19 updates for Feb. 2 reports 429 new cases, eight new COVID-19 related deaths, for a total of 1,218 deaths in British Columbia, with 140,452 doses of vaccine now administered to date.
https://t.co/BatCkWJTWY",eastknow,0,e-KNOW,en
218,2021-02-02 23:51:32+00:00,1356752141595992065,"Not Covid vaccine, infraction in brain caused ASHA worker's death in Andhra's Guntur: Post-mortem report https://t.co/6wb2nnzIjd",netamakerIndia,0,Netamaker,en
219,2021-02-02 23:51:17+00:00,1356752076840304648,Private practice attorneys seeking COVID-19 vaccine priority – Jacksonville Daily Record – ChronLaw 6th Amendment News #6thAmendment https://t.co/o3KaxkwJet,ChronLaw,0,ChronLAW | News for Legal Professionals,en
220,2021-02-02 23:51:09+00:00,1356752046259662852,Commissioner Vilma Leake received her second dose of COVID-19 vaccine last Saturday. She says she had no problems #MeckBOCC,JoeBrunoWSOC9,6,Joe Bruno,en
221,2021-02-02 23:51:05+00:00,1356752028584787969,You think after all this is done when ppl ask for clean papers you think  they will ask if you got a covid vaccine as well? https://t.co/Eg2rKR8qV8,LuxLori_,0,Lori Thee Ascended,en
222,2021-02-02 23:51:02+00:00,1356752014726856710,"Some hospital systems have given major donors special access to the Covid-19 vaccine. 

That ""transgress the very notion and spirit of philanthropy,"" says @AFPMikeGeiger.  https://t.co/Rmk5GWLRXR",_emilyhaynes,1,Emily Haynes,en
223,2021-02-02 23:51:02+00:00,1356752013900599297,"Our Wednesday Sun editorial: Trudeau spinning us on vaccines: Despite announcing his long-term plans to produce COVID-19 vaccines in Canada Tuesday, the PM ended up in the same place where he  started - a shortage of much-needed vaccines right now
https://t.co/hFpxtY9Wk3 #cdnpoli",sunlorrie,434,Lorrie Goldstein,en
224,2021-02-02 23:50:59+00:00,1356752001984581633,Yeahhhhhhh 👉 MISSION ACCOMPLISHED 👉 The DEATH TOLL is just starting and the vaccines designed from the D614 instead of D614G are fulfilling their role 👉 SPREAD COVID-19 👉 Science and scientists saving lives... from the “educated” folks that SUFFERED ZERO from this GENOCIDE 🤮 https://t.co/3VUCp0IBy7,qwert03118543,1,qwert,en
225,2021-02-02 23:50:54+00:00,1356751982157910016,"@globalnews Open it all up. FACT: lockdowns do not work at lessening Covid. Neither do masks.

And vaccines are quite questionable in their effectiveness - look at Israel.",gmonmouth1,0,Geoffrey Monmouth,en
226,2021-02-02 23:50:53+00:00,1356751976290279425,The United States now has a federal pharmacy COVID vaccation plan...where is Canada's plan? Get the vaccine to the people...not the people to the vaccine. https://t.co/oKZpepYWrk,glendoucet5,2,Glen Doucet,en
227,2021-02-02 23:50:53+00:00,1356751976164429826,Well well well! The #Russian #CovidVaccine was the first and maybe the best if this is right. 91% effective according to a peer reviewed study in @TheLancet https://t.co/GXVimXXIMe,jackiekemp,1,jackie kemp,en
228,2021-02-02 23:50:50+00:00,1356751964034502658,I am super thankful for our opportunity to partner with IMMY LABS to provide free COVID-19 Vaccines at the Rose Bowl. Spread the word!!!! https://t.co/0bis3TTLDU,B2himglory,6,Joe Blankenship,en
229,2021-02-02 23:50:48+00:00,1356751959164932098,"@TedUrchin This week the media tells us we are over the peak. Maybe in London but not in the country. People are frightened, staying indoors.Our local hospitals are full of covid &amp; we are way behind with vaccines. How can we be over the peak? More propaganda? Why can't we be told the truth?",pwsimerimiaw,5,Buddug~ #Johnson Out~fblc~ ⚫🕷,en
230,2021-02-02 23:50:48+00:00,1356751958544183297,I Volunteered To Administer COVID-19 Vaccines. Here’s What I Saw During My Shift. https://t.co/bAZxSkkDpX via @Yahoo,Coleshsmartinez,0,John Martinez,en
231,2021-02-02 23:50:48+00:00,1356751958414159873,"@thomaskaine5 I just received my first Moderna vaccine today. I feel fine. My brother (EKG Tech) and my sister (frontline Resp. Therapist) received the first and second doses of the Pfizer vaccine. My brother c/o arm pain on second dose and headaches. Both are fine. 
#CovidVaccine",jerseymagician,0,becca,en
232,2021-02-02 23:50:47+00:00,1356751951988289537,"@jonathanvswan @Haleaziz Done ✅ . Jonathan, 2 ?s:
1) Did you get your COVID vaccine yet, per recommendation of your lovely wife @woodruffbets via your BMI? 😀 
2) Are you on the witness list for Impeachment trial so we can all relive the delicious clips of your facial expressions w crazy 45 interview?😆",BarbFrericks,3,Kornacki’s Khakis,en
233,2021-02-02 23:50:40+00:00,1356751924587081728,Pregnant people deserve better data on Covid vaccines  https://t.co/Up4JdlYz1i,Lawlor224,0,Kim,en
234,2021-02-02 23:50:39+00:00,1356751918106869761,first round of the covid vaccine is really kicking my booty,Brooke__Haley,1,B🦥,en
235,2021-02-02 23:50:38+00:00,1356751915900522497,"@markstrahl Because it's Calgary and not Montreal
COVID vaccine solution was here in Calgary - Trudeau looked to China
We never asked for $1B we asked for $35M
Had we gotten that we wouldn't be starting Phase 1 right now, we would be in Phase 3 Providence Therapeutics
https://t.co/i26yWBdZEW",CRC57325971,1,CRC,en
236,2021-02-02 23:50:38+00:00,1356751914084560897,I heard on @MarkSimoneNY show today that the Biden Administration has lost 20 million Covid Vaccines. Me thinks Hunter got another side hustle going on. Any ideas?,howyoodooin,0,Ronnie Daniels,en
237,2021-02-02 23:50:36+00:00,1356751905637216258,"As of late January into this new month, NJ has added new #COVID vaccine sites in Middlesex County https://t.co/xP5QRyYZQO",tiannabrad1,0,tianna the publicist,en
238,2021-02-02 23:50:34+00:00,1356751898020372480,Video Uses Bogus Claims to Stoke Race-Based Fears of COVID-19 Vaccine https://t.co/Rp5WeclwZb,laniercountynet,0,Lanier County Network,en
239,2021-02-02 23:50:33+00:00,1356751896179007488,Really wonder what I’ll have access to first. COVID vaccine or a PS5?,cmcclur34,2,Connor McClure,en
240,2021-02-02 23:50:30+00:00,1356751880714481665,"JUST IN: Colorado restaurant workers are being moved into Phase 1B.3, meaning they could get COVID-19 vaccines early next month: https://t.co/pVHIgVPKC7",KDVR,18,FOX31 Denver KDVR,en
241,2021-02-02 23:50:27+00:00,1356751869784260609,@DexterFizz Covid vaccine look.,CurbsideJones,0,LilCucciMayne2k22,en
242,2021-02-02 23:50:27+00:00,1356751868693803008,@Pessimisticoops PS: Covid deniers p*ss me off too. The next person I see that's unmasked without a valid reason for being so or shouting that lockdowns and vaccines don't work is getting a clip round the lugs. I work in retail and I'm absolutely sick to the back teeth of them! 🤬,thequalmpeddler,0,Little Miss Lesley. 💫,en
243,2021-02-02 23:50:27+00:00,1356751868681216002,"TRUMP administration went out of there way to find parents but just being dropped at the boarder made it hard. Trump seperated zero children from parents. Parents left them at the boarders &amp; left.
Covid more important haven't heard any plan to expand production of vaccine 🤔🤥🇨🇳 https://t.co/2Wf58rgc6n",DonFrance9,1,Don#MAGA🇺🇸💪,en
244,2021-02-02 23:50:23+00:00,1356751854420566016,Federal Government expecting 15 million doses of COVID-19 vaccine in February https://t.co/0LX9QgwBPi,adegoke312,0,holuwatocyn,en
245,2021-02-02 23:50:20+00:00,1356751841283899393,Canadians asking the federal government when we might see a made in Canada Covid Vaccine https://t.co/d0kk3DZpUA,Kelloggs2010,3,Kelly Fatteicher,en
246,2021-02-02 23:50:19+00:00,1356751834120134658,COVID-19 vaccine FAQ: You have questions. We have answers. https://t.co/XPqXou274q via @jaxdotcom,rbnsnest,1,Robin H Patton,en
247,2021-02-02 23:50:17+00:00,1356751826817847296,People who had COVID-19 may develop 10 times as many antibodies after a single vaccine dose - a s... https://t.co/KNUwKpwdtc via @Yahoo,Coleshsmartinez,0,John Martinez,en
248,2021-02-02 23:50:17+00:00,1356751826616545283,Federal Government expecting 15 million doses of COVID-19 vaccine in February https://t.co/2MEjTxrdVD,Osisancash1,0,www.Trendjamz.com.ng,en
249,2021-02-02 23:50:16+00:00,1356751822707449859,First Nations in Quebec 'ready and waiting' for COVID-19 vaccines https://t.co/K6PTjDqGEt,CBCMontreal,5,CBC Montreal,en
250,2021-02-02 23:50:14+00:00,1356751813517664260,"One of the largest drive thro vaccination hub in the country at Texas. 1000 shots per hour 👏👏👏

Kudos to everyone who pulled it off .. #Texas #COVID19 #CovidVaccine #TexasCovidVaccineHub https://t.co/IfCGQyBqXz",vaisu_tweets,2,vaishali,en
251,2021-02-02 23:50:13+00:00,1356751809512054784,"Scientists gave Russia’s Sputnik V vaccine the green light on Tuesday saying it was almost 92% effective in fighting COVID-19 based on peer-reviewed late-stage trial results published in The Lancet international medical journal.
https://t.co/BDcRxxPA0v",JohnSpeikers,0,J. O. Quantaman,en
252,2021-02-02 23:50:09+00:00,1356751791929630720,"@italkfreespeech @bopinion Incorrect, the covid vaccine doesn’t. The original test for the first polio vaccine did use aborted fetus cells to test to see if the vaccine would work, the cells aren’t actually included in the vaccine itself, nor has any vaccine after included them.",FYamaku,8,FreyR ᛗ ᚠ,en
253,2021-02-02 23:50:08+00:00,1356751789047967747,scheduled a covid vaccine for myself and I am sooooo excited,sameerkanafani,10,sameer,en
254,2021-02-02 23:50:08+00:00,1356751787424940034,"Russian scientists say country's Sputnik V vaccine appears safe, effective against COVID-19 https://t.co/cBumBX560g",WTAE,0,WTAE-TV Pittsburgh,en
255,2021-02-02 23:50:06+00:00,1356751781691351043,How I almost fell for a COVID vaccine scam https://t.co/ztV0nxqGS6,leseSMBAdvisor,0,Les Ehrsam,en
256,2021-02-02 23:50:05+00:00,1356751775819251713,Volunteers at DeVos Place clinic eligible for COVID-19 vaccine https://t.co/buBXzcXsgO,MLive,8,MLive,en
257,2021-02-02 23:50:05+00:00,1356751775718641670,"@GovAndyBeshear @louisvillejg82 Andy Beshear, you've been a great governor as pertaining to COVID.  Do NOT let up when we're so close to getting the vaccine!",louisvilledw1,0,"Yes, Nilalohita!",en
258,2021-02-02 23:50:04+00:00,1356751772157685763,"The best place to get accurate and up-to-date information about COVID-19 is the Centers for Disease Control. The CDC provides information on each phase of the vaccine, what to expect before getting vaccinated and possible allergic reactions. Learn more at https://t.co/apgsKmcZuc https://t.co/DmjGwjsEj2",bakhearthosp,0,Bakersfield Heart Hospital,en
259,2021-02-02 23:50:03+00:00,1356751769980837888,"Have questions about cancer and the COVID-19 vaccine? Check out this @CancerTodayMag article! 

https://t.co/DWz7y2IwN7 https://t.co/VbZeCPNrG3",chemowave,3,chemoWave app,en
260,2021-02-02 23:50:03+00:00,1356751767380328451,"@LeahButlerSmith @jamesjsbeatty @1974_knight @ianbrown How can it be a covid ward when you say none of the patients have covid?
It takes 3 weeks for vaccine to become fully effective so until then people can catch covid and get ill from it
Old folks are constantly dying of various things so some will die after vaccine of other things",danbdennis,3,Dan Dennis,en
261,2021-02-02 23:50:00+00:00,1356751754700992513,"Given the importance of COVID-19 #vaccine outreach and Welltok’s expertise, we surveyed 1,000 adults across the U.S. to give a voice to consumers on the topic. Download to see what they had to say: https://t.co/xfIIRRBOyP https://t.co/5ik8UmIWaQ",Welltok,0,"Welltok, a Virgin Pulse company",en
262,2021-02-02 23:49:58+00:00,1356751748984049664,@DionLimTV can you please do a local story on Adults with Disabilities being taken off the priority list for Covid vaccines by the Governor https://t.co/4G6NfIZ3qC,christi65764465,0,christine,en
263,2021-02-02 23:49:56+00:00,1356751741098680323,Super helpful summary thread on Secretary Ghaly's presser on COVID vaccines. https://t.co/Yi1uQPvray,D_Mart83,4,Danny Martinez,en
264,2021-02-02 23:49:55+00:00,1356751733616173056,"@YoniMichanie @Spinozasrose @JamaalBowmanNY @RashidaTlaib to coordinate the response to Covid-19; AND that
The P.A. has made its own arrangements for vaccines.

If the P.A. which is internationally recognized as the governing body of the Palestinian Arab people, has publicly declared its own responsibility for vaccinations, 

2/",artstop,7,Arthur Normanson 🚒💦🔥,en
265,2021-02-02 23:49:51+00:00,1356751718504087552,"Here's why some people test positive after getting a Covid-19 vaccine
https://t.co/9kBJXkm7jo",C3Twitty,2,Soba Davis,en
266,2021-02-02 23:49:50+00:00,1356751714695733250,Pfizer Ahead of Schedule to Release 200 Million Doses of COVID-19 Vaccine  https://t.co/FVTXgqh9A4,fofogeorgiou,7,Francine Carson,en
267,2021-02-02 23:49:48+00:00,1356751707032682496,"Love seeing my fellow @AIDHC @JeffersonUniv Pediatric Residency Alumni fighting #COVID19!

Doing our part to combat #COVID both on frontlines AND with vaccination!

#ThisIsOurShot #CovidVaccine #deCOVID
Photo compilation credits: Dr. V. Carlo &amp; C. Chuidian, program coordinator. https://t.co/kUCjQESuM1",DocLauraLawler,10,"Laura Lawler, MD",en
268,2021-02-02 23:49:44+00:00,1356751690473603075,@BeauxReliosis Do we know that every covid vaccine has this? Is there one that doesn't? My husband is chomping at the bit to get it and most of our friends already have.,Twittterpated,0,Too woke for you,en
269,2021-02-02 23:49:38+00:00,1356751664267558919,"Russia's COVID-19 Vaccine 91.6% Effective, Studies Show https://t.co/6JCRFd4KW0 #coronavirus",drummike2012,0,Mike Williams,en
270,2021-02-02 23:49:28+00:00,1356751620353196035,"-140,452 doses of COVID-19 vaccine  administered in B.C
- 5,097 are second doses
- One new health-care facility outbreak at CareLife Fleetwood (Surrey)
- Outbreak at Heritage Retirement Residence (Kelowna) now over

#COVID19bc   #bcpoli",cfax1070,1,CFAX1070,en
271,2021-02-02 23:49:27+00:00,1356751616209256449,Pfizer forecasts $15 billion in revenue from Covid vaccine in 2021 - CNBC https://t.co/wHtA1ff0xt,CindyLSchroeder,0,Cindy Saalfeld,en
272,2021-02-02 23:49:18+00:00,1356751579282554881,Really appreciating this very helpful &amp; honest CH conversation among Black &amp; Brown medical providers dealing with anxieties around the COVID 19 vaccines https://t.co/2QINBVnwvv,RamiNashashibi,6,Rami Nashashibi-,en
273,2021-02-02 23:49:16+00:00,1356751571674095622,"Only 38% of nursing home workers accepted COVID-19 vaccines, new data shows https://t.co/3DI92QE6ct via @Yahoo",Coleshsmartinez,0,John Martinez,en
274,2021-02-02 23:49:13+00:00,1356751556713013248,"Holding up West Virginia’s success, lawmakers debate states’ sluggish COVID-19 vaccine rollout https://t.co/cbw4HoYs7v",lokeshjaral1,0,Lokesh Jaral,en
275,2021-02-02 23:49:06+00:00,1356751528049139719,"Experts Re-Examine 2-Dose Policy 

“data from both companies show the first dose of the vaccine offers significant protection against COVID-19 in the SHORT TERM, for at least 1 to 3 months after injection”

If unable to get a 2nd dose-protection is gone?
 https://t.co/QnGT74nQfg",roxie32819,0,Roxie🇺🇸🇺🇸🇺🇸,en
276,2021-02-02 23:49:05+00:00,1356751527218716680,"Exciting News:
Get a Notification for COVID-19 Vaccine Clinics on Cape Cod. Sign up today for e-mail notifications from Barnstable County Department of Health and Environment at least 24 hours in advance of a clinic being open for registration.  Go to https://t.co/lWUIDrNgp1 https://t.co/le9DhUaaev",falpublib,2,Falmouth Public Library,en
277,2021-02-02 23:49:01+00:00,1356751508289781760,"Doctors Around the World Issue Dire WARNING DO NOT GET THE COVID VACCINE

https://t.co/XJWe4m3a0e",TXLADY7061,4,TXLADY706,en
278,2021-02-02 23:49:01+00:00,1356751507455021057,"The U.S. government will send 1 million COVID vaccine doses to 6,500 retail pharmacies this month as part of a program to deliver vaccines directly to drugstores and grocery stores https://t.co/2Bj0gYUoLa @higginsdunn #drugstores #pharmacy #covid19 #vaccinations #unitedstates",albertfong98,0,Albert Fong,en
279,2021-02-02 23:49:00+00:00,1356751503239892992,"Yesterday I was ""unblinded"" from the COVID-19 vaccine I am participating and I have been vaccinated. I had an odd thought/feeling - I am one of the first 100,000 people on Earth to be vaccinated. Excluding possible test subjects in PRC or RU. Those numbers have been kept secret.",parke_j,2,Juan W Parke,en
280,2021-02-02 23:48:59+00:00,1356751501138493440,"Covid vaccine coming to certain Dillons pharmacies. 
https://t.co/noV3srQQHY",CraigNigrelli,0,Craig Nigrelli,en
281,2021-02-02 23:48:55+00:00,1356751484466188290,"Oxford Covid vaccine offers 76% protection for up to 12 weeks after first dose, study shows https://t.co/IdE9EZrm0w",DoctorPanama,5,"Julio Miranda, MD",en
282,2021-02-02 23:48:52+00:00,1356751469668536322,"DOH Secretary-Designate Dr. Tracie Collins and HSD Sec. Dr. David Scrase will provide a COVID-19 and vaccine webinar update Wednesday, Feb. 3, at 1 p.m. MST. The news conference will be streamed live on the NMHSD Facebook page: https://t.co/RChow6OwSw https://t.co/s4qalROzHp",NMHSD,27,NM Human Services,en
283,2021-02-02 23:48:51+00:00,1356751467881799681,Where can you get the Covid vaccine?,SherryG45654834,0,Sherry Graham,en
284,2021-02-02 23:48:50+00:00,1356751463763095554,"@Rebilium @OlifaNT @ZStupidity @DrEricDing Good luck and I hope you and your family do receive the vaccine for covid-19
Use twitter to have your plight heard",petronus20,0,Never to Late,en
285,2021-02-02 23:48:43+00:00,1356751434876923906,Covid: France restricts AstraZeneca vaccine to under-65s - BBC News. Interesting. as one with a long history in therapeutics and experience in treating older people can we please include our older people in these studies to help avoid these situations https://t.co/ErpQFCdkhY,OFMPP,3,peter passmore,en
286,2021-02-02 23:48:34+00:00,1356751394443788288,"@davidsylva05 @DavidLammy Many years experience of covid ? We've all as much as him. 
He's basing all he says on work being done in the USA. Their highest medical institutes have still passed the vaccines. UK's, EU, etc all passed by eminent &amp; very top level institutions. Higher than him.
No more from me.",PDF53,0,Sir Lincoln Lad,en
287,2021-02-02 23:48:33+00:00,1356751392011145217,So uh apparently that whole thing with the guy trying to sell that covid vaccine in my apartment made the news 🙃,RantsByMegan,5,meh,en
288,2021-02-02 23:48:27+00:00,1356751364605501450,"Another new preprint on reduced dosing strategies in the young to accelerate vaccination. This time in the US

Minimizing loss of life in Covid-19 in a 100 day period in the U.S.A. by age-tailored dosing and distribution of a limited vaccine supply https://t.co/lOz6UG0UGk",natashaloder,3,Natasha Loder,en
289,2021-02-02 23:48:26+00:00,1356751362986569728,"I asked my rheumatologist for a COVID vaccine yesterday and she informed me that my autoimmune disease did not qualify me under 1b for the vaccine. The shortage here is so bad that 1b is basically cancer patients and 75+, ""but they're pushing for only 75+."" 

I am so mad. https://t.co/8ZZUvLtYc9",spacecasemir,1,"Miriam, your CPA friend",en
290,2021-02-02 23:48:26+00:00,1356751360381890568,just registered for the covid vaccine uwu,RLvanah,1,˗ˏˋ rairai ´ˎ˗,en
291,2021-02-02 23:48:23+00:00,1356751351095648257,"Mehn... US have administered 32m doses of covid vaccine and distributed over 52m. 

When you’re bug, you’re big.",Ad3ola_,0,Omoluabi Okemesi,en
292,2021-02-02 23:48:22+00:00,1356751344766513152,"'Vaccine nationalism' echoes the disastrous mistakes made with HIV—Although HIV and Sars-CoV-2 are very different viruses, the Covid-19 pandemic has highlighted striking parallels | Coronavirus | The Guardian https://t.co/AhrLqo7tqM https://t.co/aQ0YvhXIBo",VernonDavis,0,Vernon Davis,en
293,2021-02-02 23:48:21+00:00,1356751339338956808,"I hope they come soon to https://t.co/I0OgvlYQmG! I was turned away at the #Disneyland site because I’m in group 1B, and they are only vaccinating 1A! #foodworker #covidvaccine @GavinNewsom #othena https://t.co/1nI8bJOqGA",CeliacHashiGirl,2,CeliacHashiGirl,en
294,2021-02-02 23:48:17+00:00,1356751322884698114,"Canada could be producing COVID-19 vaccine domestically by the fall

Didn’t Sparkle Socks tell us we would all have the vaccine by September?? Now he says we won’t be able to even start producing it till the fall. Drama teachers shouldn’t run countries https://t.co/lvk0d1YZpN",hilgy23,2,Kris Hilgersom,en
295,2021-02-02 23:48:14+00:00,1356751312801652736,"If you die for any reason within 28 days of testing positive for covid-19 it's a covid death. 

Die within days of having the vaccine, it's just a coincidence and you must be some kind of conspiracy theorist to even mention it.

Where we're at.",brijoyce,15,Bri Joyce,en
296,2021-02-02 23:48:14+00:00,1356751311849553920,"Via @euronews: COVID-19 vaccine: Russia's Sputnik V jab has efficacy of 91.6% against coronavirus, say experts  https://t.co/f715Kuc0OY",Zaid_Almahdawi,0,Zaid.H.AlMahdawi,en
297,2021-02-02 23:48:08+00:00,1356751285920366599,All adults to get Covid vaccine – Dominguez https://t.co/jgcvOuxZ9b via @The Manila Times 🙃🙃🙃🙃🤬🤬🤬🤬🤬🤬,ChiliMosquito,0,Mosquito chili,en
298,2021-02-02 23:48:02+00:00,1356751261740265480,"We know access to COVID vaccine is a privilege, and we're committed to doing our part to stomp out this virus in our community. Thanks to our friends at @OurLegacyHealth,  Kaiser and @OHSUNews for helping us gain access to these precious vaccines for every CCC employee. 💪 🙌 https://t.co/BizFifnphH",CCCPortland,4,Central City Concern,en
299,2021-02-02 23:48:01+00:00,1356751256832901121,Can't sleep cause I'm getting my covid vaccine tomorrow and I honestly feel like a kid at Christmas,g0withthechl0,9,chlo🏳️‍🌈,en
300,2021-02-02 23:48:00+00:00,1356751251409522688,"People who’ve had COVID-19 may not need both doses of the vaccine, study suggests
https://t.co/aCccRQ70NS",Daily_Press,0,Daily Press,en
