,Datetime,Tweet Id,Text,Username,Like Count,Display Name,Language
479,2021-02-23 23:36:13+00:00,1364358432992673795,"The COVID-19 Vaccine Distribution Plan in Rhode Island
https://t.co/LypzE8M9Nq?...
https://t.co/TIJKLlzStK",Sharecaster1,0,Sharecaster.com,en
480,2021-02-23 23:36:09+00:00,1364358417389862912,"@RobertKennedyJr “Bizarrely, Fauci’s January comments indicated that 20,000 pregnant women had received COVID vaccines, “
Strange, the link you provide was published in February and would make sense with Fauci’s subsequent figures. 10,000 Feb. 3rd and then 20,000 Feb. 10th.",mamaintroverted,0,IntrovertedMama,en
481,2021-02-23 23:36:08+00:00,1364358412214140931,"Where did Covid come from? What do new variants mean for current vaccines? How can we tell if someone is protected? Join us for this online seminar from Dr. Nick Wohlgemuth, virologist at St. Jude’s Children’s Research Hospital.

Fri Feb 26 @ 7pm

Signup: https://t.co/JzCYusDACz https://t.co/p25PiKz4ze",BUGSSlab,1,BUGSS,en
482,2021-02-23 23:36:01+00:00,1364358382975676416,can’t tell if i’m experiencing fatigue from covid vaccine or just my usual fatigue ... hard to say,uglytrashgirl,9,jeth,en
483,2021-02-23 23:36:00+00:00,1364358376726007808,"Join me this Thurs, Feb 25 for a thought-provoking discussion on how the combination of #data, #behavioralscience &amp; #CommunityEngagement can help get #COVIDVaccine shots in arms as quickly as possible. Register here: https://t.co/uDOahM7obW",SemaSgaier,0,"Sema Sgaier, PhD",en
484,2021-02-23 23:35:59+00:00,1364358374524145672,"Really @abcnews? Over 500,000 Americans dead from Covid, vaccines still in short supply, congressional hearings on January 6th started today, and your top news story of the day is Tiger Woods’ car accident? https://t.co/1ABOK3v8Ln",coffeepenia,0,something witty,en
485,2021-02-23 23:35:58+00:00,1364358369247657988,"Beyond Covid, I think we're at the point of having an universal app for required vaccines to enter some countries. One app, one standard for all airlines and countries to interface. There are even ways to only show checkmarks to avoid sharing the data itself! https://t.co/wDzBHVoOub",jeff_maljjin,0,Jeff Blanchette,en
486,2021-02-23 23:35:53+00:00,1364358347307311112,Officials: More than 600 Pa. nursing homes have received 2nd covid vaccine doses https://t.co/bnhkOKCjNW https://t.co/DU3FiLRgUA,dubvNOW,1,🗣️dubvLIVE.com🇺🇲➡️🌎🔊,en
487,2021-02-23 23:35:52+00:00,1364358342802604037,Millions of people around the world may not get access to a COVID-19 vaccine until as late as 2024 unless @POTUS @JoeBiden reverses the Trump administration's blockage of emergency measures at the World Trade Organization: https://t.co/1DXWbyStWE #WTO #PeoplesVaccine,PacoRivera12,0,Paco Rivera,en
488,2021-02-23 23:35:51+00:00,1364358340525064193,"@POTUS I bet you have your dogs Covid vaccines! What about the olderly ?
You should follow Florida they doing great",fedian4421,0,Jon Miller,en
489,2021-02-23 23:35:49+00:00,1364358331461234691,".@RepGwenMoore @SenRonJohnson @SenatorBaldwin Effective vaccines are key to ending the pandemic, but only if the most vulnerable, everywhere, can access them. Congress must invest at least $20bn to fight COVID-19 globally. #ONEPowerSummit https://t.co/T4MTwgGPMl",dawsparrow,0,David Allen W,en
490,2021-02-23 23:35:48+00:00,1364358328713957376,".@RepDavids @JerryMoran @RogerMarshallMD Effective vaccines are key to ending the pandemic, but only if the most vulnerable, everywhere, can access them. Congress must invest at least $20bn to fight COVID-19 globally. #ONEPowerSummit https://t.co/anMSvnazZ2",lea6459,2,Lea Johnson,en
491,2021-02-23 23:35:48+00:00,1364358327229173762,So relieved to have gotten my mother the COVID vaccine!  Now trying to get 86 yr old father in law with heart disease and diabetes vaccinated with no success. https://t.co/QHCZaSPUJw,SarahTishkoff,55,Dr. Sarah Tishkoff,en
492,2021-02-23 23:35:46+00:00,1364358319784263692,@themood2020 Always a price to pay 'have the vaccine back to normal' 'had the vaccine but still stay at home' 'let you out when you have the Covid pass' 'let you out when you have been microchipped',Dave22552702,1,Hullpup,en
493,2021-02-23 23:35:40+00:00,1364358296086278149,"@bridget_joy_ Vaccines will prevent becoming gravely ill

Therefore, it does not mean you're NEVER going to catch covid

The goal is cut down hospitalizations &amp; deaths

Both of which aren't fun https://t.co/Gui8gRGvAS",genevieve_anais,11,GenevieveAnais,en
494,2021-02-23 23:35:40+00:00,1364358295948038144,Now Playing As COVID 19 Vaccines Arrive by CVS Health is Ready Commercial Listen online at https://t.co/uCKDOQnTOP https://t.co/ATcKqkqZHX,RejoiceAmerica,0,RejoiceAmericaRadio,en
495,2021-02-23 23:35:40+00:00,1364358294437945344,Doctor stood down after administering incorrect dose of COVID-19 vaccine to aged care residents https://t.co/GFW37zxdmJ,brisbanetimes,1,Brisbane Times,en
496,2021-02-23 23:35:38+00:00,1364358284610727936,"Two elderly Australians from a Queensland aged care facility have received an incorrect dose of the COVID vaccine. @GregHuntMP says this has happened in the early stages of vaccine rollouts in other countries, with minimal side effects.  https://t.co/gCqCB9WFSV #COVID19 #7NEWS https://t.co/mwvC8wl461",7NewsSydney,4,7NEWS Sydney,en
497,2021-02-23 23:35:37+00:00,1364358279502127104,#NHS #app could show #Covid #vaccine #status or latest test result https://t.co/ZMa3VlXsg5,McEwanMorton,0,McEwan 3.5% FBPE #BLM #GTTO #CitizenOfNoWhere,en
498,2021-02-23 23:35:35+00:00,1364358273881628676,@Peter_Fitz Having worked in healthcare for more than 30 years Big Parma is an issue to be watched. Difference with the COVID vaccine science is the whole world has acted as real time reviewers keeping the process as honest as possible. remdesevir and hydroxychloroquine is a different story,Sst73881Stuart,0,Stuart Stapleton,en
499,2021-02-23 23:35:31+00:00,1364358256085336067,@megtirrell There are certain things in life that one never forgets like where you were on 9/11. I will always remember that I was with Meg when I found out we had a successful Covid vaccine !!!!,SteveRocco7,0,Dr. Steve Rocco,en
500,2021-02-23 23:35:30+00:00,1364358253476515844,What's going on with the @FDA and  #BidenAdministration holding up the approval of the J&amp;J #COVIDVaccine . They've been sitting on the approval for weeks. Do they want more people to die so they can pass their $1.9b bill? #DemocratsAreDestroyingAmerica #BidenActNow #CORRUPTION,decodethespin,0,P. Trotter,en
501,2021-02-23 23:35:25+00:00,1364358231326298116,"Two elderly Australians from a Queensland aged care facility have received an incorrect dose of the COVID vaccine. @GregHuntMP says this has happened in the early stages of vaccine rollouts in other countries, with minimal side effects.  https://t.co/AtT3f6NjmO #COVID19 #7NEWS https://t.co/RFU0Sq99gZ",7NewsPerth,0,7NEWS Perth,en
502,2021-02-23 23:35:23+00:00,1364358223185154050,"The measure authorizes the national government, local governments and the private sector to buy vaccines through the NTF Against COVID-19 and DOH.

Read: https://t.co/aYVdFk56zt https://t.co/eYYa88atix",inquirerdotnet,6,Inquirer,en
503,2021-02-23 23:35:13+00:00,1364358179648233475,"Two elderly Australians from a Queensland aged care facility have received an incorrect dose of the COVID vaccine. @GregHuntMP says this has happened in the early stages of vaccine rollouts in other countries, with minimal side effects.  https://t.co/qEKab0Xri1 #COVID19 #7NEWS https://t.co/o1qvrFIAOk",7NewsMelbourne,4,7NEWS Melbourne,en
504,2021-02-23 23:35:13+00:00,1364358179342213125,"@JethroFElsden @DunnsDee @ThatRyanChap @andrew_lilico ...vulnerable groups should have had their second dose
c) I'm assuming that if you've had covid then you're 100% immune already (better than the vaccine) - may be wrong but that's the assumption.",JamesWard73,1,James Ward,en
505,2021-02-23 23:35:12+00:00,1364358177588867078,ALERT 🚨 New Jersey nursing home resident who tested positive for COVID on her 105th birthday after getting her second vaccine shot beats the virus and credits her survival on consuming nine gin-soaked raisins a day (Daily Mail) https://t.co/vsnm6RUlkG,TheInsiderPaper,44,Insider Paper,en
506,2021-02-23 23:35:10+00:00,1364358167614939137,"I asked Bill Gates who is spreading the conspiracy theories that he's implanting chips in COVID-19 vaccines, etc. Here's what he told me: https://t.co/jwPKa02sAD @miamiherald",oppenheimera,34,Andres Oppenheimer,en
507,2021-02-23 23:35:06+00:00,1364358152737722371,Bc of this pandemic / Covid 19 / vaccine I realized people are so stupid. First off you need to read the whole article not just the headline to understand what it’s trying to tell you. 🤦‍♀️ (these ppl are the same ppl in high school who never read the instructions on the test 😂),shannnnnnx3,1,Shannon Epsky,en
508,2021-02-23 23:35:04+00:00,1364358142025342983,"@ndtv The whole world is now watching the smile of the Premier , the tears of Uighur &amp;cry of the colonies for
 democracy. But how far to remain away is a question when even their covid vaccine are used by countries.",mathew_tomi,0,tomi mathew1,en
509,2021-02-23 23:35:03+00:00,1364358138795683841,"More than 2,200 homeless Chicagoans, shelter staff receive COVID-19 vaccine: ‘I was happy we were able to get it here’: hi INDiA Homeless Chicagoans are receiving COVID-19 vaccines as part of a city strategy to aggressively… https://t.co/XNcgW8w1eS | https://t.co/Vhb7EKELqw https://t.co/P4IATlRfGo",hiindia,0,hi INDiA News Media- News updates 24/7,en
510,2021-02-23 23:35:03+00:00,1364358137474605058,"Read about how several cultural and technical factors aided West Virginia in creating a successful COVID-19 vaccine distribution program from ACS Board of Governors’ @BryanRichmondM1 MD, FACS, chair of surgery at @WVUMedicine. 

https://t.co/dFizMUtGNm https://t.co/ya9qVT7sJq",AmCollSurgeons,4,American College of Surgeons,en
511,2021-02-23 23:35:01+00:00,1364358131485192192,Most COVID-19 #vaccines are considered safe for patients with cancer. Via @EverydayHealth https://t.co/nID3krc4Rt,CancerResearch,4,Cancer Research Institute,en
512,2021-02-23 23:35:01+00:00,1364358129543045121,@Giamdaddy I thought we were taking about Covid relief?  Of course I believe this.  I thought it was vaccine distribution you were taking about. I think the kids at the border and that are lost need to be handled ASAP. I’m trying to give him time. HMU day 101,msln123,1,just LN,en
513,2021-02-23 23:35:00+00:00,1364358126581936128,"Update on COVID-19 Vaccination- Day 39th.
🔘More than 1.19 Cr vaccine doses administered.
🔘1.61 L vaccine doses given till 6 pm today; 63,458 HCWs received second dose of vaccine as on 23rd Feb21 .
 #LargestVaccineDrive  #appropriatebehaviour .
#JanAndolan #IndiaFightsCorona https://t.co/oBteGoER77",prodefencechan1,13,prodefencechandigarh,en
514,2021-02-23 23:35:00+00:00,1364358125524975620,"104 YEARS YOUNG: Morris Park man is scheduled to receive his second COVID-19 vaccine shot soon, and says he couldn’t be happier.
https://t.co/6gA4C4Wzdp",News12BX,3,News12BX,en
515,2021-02-23 23:35:00+00:00,1364358125214527494,"104 YEARS YOUNG: Morris Park man is scheduled to receive his second COVID-19 vaccine shot soon, and says he couldn’t be happier.
https://t.co/kL8SKEaEja",News12BK,0,News12BK,en
516,2021-02-23 23:34:59+00:00,1364358120672288773,@asthmauk Because I had a pre Covid chest virus in February 2020 I got called for a flu jab for the first time..........I am asthmatic and it has got worse since the virus..........today I got a call from my surgery offering me the vaccine - I am 58 and I accepted straight away,KarenHenley_54,4,Karen Henley,en
517,2021-02-23 23:34:55+00:00,1364358105786585089,"COVID-19 vaccines safe, effective – FDA assures public https://t.co/QyTMNgumnP",gobradiouk,0,GOB TV and Radio,en
518,2021-02-23 23:34:53+00:00,1364358098350206976,"Everything you need to know about getting a Covid-19 vaccination as the rollout extends across the U.S.

#COVID19 #vaccine 

https://t.co/zfBg3yr6Ln",aerglan,0,Aerglan Technology LLC,en
519,2021-02-23 23:34:51+00:00,1364358090506788868,"@theweathermanda Stating that a few weeks after getting vaccinated, you (personally) won't die or get seriously ill from COVID, and that a vaccine is the ""quickest way"" (implying in the future) back to normal does not in any way equate to the pandemic immediately being over.",VORTEXJeff,0,Jeff Frame,en
520,2021-02-23 23:34:48+00:00,1364358074379591683,just booked my appointment for my covid vaccine https://t.co/DkN6m6caQF,trixienicollev,9,prozac princess,en
521,2021-02-23 23:34:44+00:00,1364358058848235521,Covid 19 vaccines just arrived at Kotoka,_badwenba,4,★badwenba,en
522,2021-02-23 23:34:41+00:00,1364358046407827456,me and the girlies getting our covid vaccines early bc doctors won’t let go of antiquated and racist fatphobia https://t.co/FvtzeDpX5j,SeymourTiddies,6,gort marson,en
523,2021-02-23 23:34:39+00:00,1364358040246362114,"Two elderly Australians from a Queensland aged care facility have received an incorrect dose of the COVID vaccine. @GregHuntMP says this has happened in the early stages of vaccine rollouts in other countries, with minimal side effects.  https://t.co/RmUFhzcfx4 #COVID19 #7NEWS https://t.co/Tx0YdJkMWC",7NewsAustralia,3,7NEWS Australia,en
524,2021-02-23 23:34:33+00:00,1364358013369282562,Seniors 75+ can book COVID vaccine appointments Wednesday https://t.co/plAKgFcJO5 https://t.co/t9iB1PbK5b,rdnewsNOW,0,rdnewsNOW,en
525,2021-02-23 23:34:33+00:00,1364358013025353728,"Tigre de Cristal Staff Receives Russia COVID-19 Vaccine, An Injection of Hope in the Resumption of International Travel https://t.co/t3DtDXOpWx",Nusaterkinicom,0,Nusaterkini,en
526,2021-02-23 23:34:21+00:00,1364357961406054402,i'm fat as hell and i'm gonna get the covid vaccine as soon as i can and i think everyone else like me should too just like everyone else talking about it says,NoraReed,192,nora dot jewelry,en
527,2021-02-23 23:34:20+00:00,1364357958092476428,"#LIVE: Premier Annastacia Palaszczuk is providing a COVID-19 update, after two elderly Queenslanders were given vaccine overdoses. #9News https://t.co/juOIJGtdQ2",9NewsQueensland,11,9News Queensland,en
528,2021-02-23 23:34:20+00:00,1364357956523843584,"Pfizer has been accused of “bullying” Latin American governments in Covid vaccine negotiations and has asked some countries to put up sovereign assets, such as embassy buildings and military bases, as a guarantee against the cost of any future legal cases.
https://t.co/axGsjgeeUR",alvaro_qc,16,Álvaro Quintero,en
529,2021-02-23 23:34:18+00:00,1364357948613386244,"@nhassanein_ You might want to look at New Mexico COVID data.  It shows that the Native American population has the highest percentage of people who have received the first COVID vaccine.  So the data, or at least some, is available.  Additionally, I'm sure the various tribes have good data",jonzac1993,0,jonzac,en
530,2021-02-23 23:34:14+00:00,1364357932759076867,UK thinktank calls for door-to-door Covid jabs to tackle vaccine disparities https://t.co/xiyfSiDohn,jacksonmary068,1,mary jackson,en
531,2021-02-23 23:34:13+00:00,1364357930603151362,My parents just got their first dose of the Covid vaccine!,matthewsoffer,6,Ⓜ️att Soffer,en
532,2021-02-23 23:34:12+00:00,1364357925913980929,"@XenaMovieFans It's great, thanks to this vaccine, you will be protected from covid, that's good news",GaudinotE_green,4,Gaudinot Élisabeth,en
533,2021-02-23 23:34:10+00:00,1364357918104109063,@patrick_oshag Covid vaccines 😜,josemarfdc,0,Josemar Faustino,en
534,2021-02-23 23:34:06+00:00,1364357900047708160,@TheEconomist @DSORennie Countries with the highest death tolls and little capacity for making sense of collective social responsibility are the most desperate for covid vaccines. China is free while Britain is still under lockdown. Have some self-respect.,WellingtonKoo,0,Wellington Koo,en
535,2021-02-23 23:34:03+00:00,1364357887435317248,"@Gergyl The animals ‘may’ suffer too. 

Horseshoe crab blood is key to making a COVID-19 vaccine—but the ecosystem may suffer.

https://t.co/1tOhwBbgHW",Karmageddon67,3,Roadkill Wallaby Reef Foundation 🌎💦🌴🦘🐨🦅🦇🐬,en
536,2021-02-23 23:34:03+00:00,1364357885908647937,A week after my vaccine- “Covid arm” hits. It’s really odd to see the site just randomly swelling up but at least it’s not painful!,Marie_Mulligan,0,Peregrin Took,en
537,2021-02-23 23:33:59+00:00,1364357869877952512,Kaiser Permanente data key to nation’s COVID-19 vaccine surveillance strategy https://t.co/DJTOWNWpIK,SCCMedAssoc,0,SCCMA,en
538,2021-02-23 23:33:58+00:00,1364357867084611588,"Petition from @asthmauk to prioritise people with asthma in the next roll out of the vaccine
#asthmaticsatrisk #asthma #COVID19 #vaccine #COVIDVaccine 
https://t.co/cOXOdzBdz5",EllieAwford,2,Ellie Awford,en
539,2021-02-23 23:33:56+00:00,1364357856821190657,Petition: Do not rollout Covid-19 vaccine passports https://t.co/nldwLdpjBf,kl3xus_,1,k lexus 💜,en
540,2021-02-23 23:33:55+00:00,1364357852286963712,"Two elderly Australians from a Queensland aged care facility have received an incorrect dose of the COVID vaccine. @GregHuntMP says this has happened in the early stages of vaccine rollouts in other countries, with minimal side effects.  https://t.co/l7WkmXiOwF #COVID19 #7NEWS https://t.co/7k7xfntfLS",7NewsAdelaide,1,7NEWS Adelaide,en
541,2021-02-23 23:33:48+00:00,1364357825737224192,Y’all this Covid vaccine is really handing my ass to me rn 🥴,B_Pulley12,0,12/12👑,en
542,2021-02-23 23:33:43+00:00,1364357803327041537,Covid vaccine jab on Thursday! One step even closer to cuddles with my dad :),LenkaPalmer,4,lenka,en
543,2021-02-23 23:33:43+00:00,1364357801363955712,"Air New Zealand is set to become one of the first airlines to trial a digital vaccine passport system for flights. Starting in April, travellers between Auckland and Sydney can prove they received the Covid-19 vaccine through the International Air Transport Ass Travel Pass app",lorettadalpozzo,7,Loretta Dalpozzo,en
544,2021-02-23 23:33:41+00:00,1364357795785682952,"@timspector @allisonpearson I can't even do that as only one person can visit, and that is my sister, who lives 3 miles away, I live 165 miles away! I doubt mine would accept a screen either and being dressed up like an astronaut. It's crazy - both myself and my sister have had the vaccine, not covid.",StinsonVoyager,0,Paul Elliott - #KBF #EnoughIsEnough,en
545,2021-02-23 23:33:40+00:00,1364357792761475072,Tricare Waives Referrals for Prime Enrollees Seeking COVID-19 Vaccine | https://t.co/ZIshP9F62v https://t.co/z4sEkMtTn1,NMNJorg,0,M Jorg,en
546,2021-02-23 23:33:35+00:00,1364357768715640836,"To Make More Covid-19 Vaccines, Rival Drugmakers Team Up https://t.co/BL8WdlA4J9",paoloigna1,1,paolo ignazio marong,en
547,2021-02-23 23:33:33+00:00,1364357762587758593,Novavax Nears Covid-19 Vaccine Game Changer—After Years of Failure https://t.co/F1r1vv6DUA,paoloigna1,1,paolo ignazio marong,en
548,2021-02-23 23:33:30+00:00,1364357749417660429,"@JeremyVineOn5 People seem to be forgetting that Covid is still around and the vaccines are NoT 💯0/0 protection.
Wouldn’t be surprised if we had another lockdown before this year is over 🙄",Sandra22199329,0,D4 🐾 & Buddy 🐾,en
549,2021-02-23 23:33:29+00:00,1364357743742570497,"Two elderly Australians from a Queensland aged care facility have received an incorrect dose of the COVID vaccine. @GregHuntMP says this has happened in the early stages of vaccine rollouts in other countries, with minimal side effects. 
 https://t.co/kKOC022PsS #COVID19 #7NEWS https://t.co/njup6zAZnD",7NewsBrisbane,0,7NEWS Brisbane,en
550,2021-02-23 23:33:27+00:00,1364357736029429767,"@HKPRDHU is expecting to receive more than 4,500 doses of the Pfizer vaccine this week, as well another 1,700 doses of Moderna. 

#kawarthalakes #kawarthas #COVID19 #COVIDVaccine #healthcare #ontpoli #COVID19Ontario 

https://t.co/io0cF2XFy1",lindsayadvoc,1,The Lindsay Advocate,en
551,2021-02-23 23:33:25+00:00,1364357725770166280,Carroll County commissioners are expressing concerns that Maryland’s COVID-19 vaccine distribution program is not getting enough shots into arms of those who need it most in Carroll. https://t.co/nJQMT4mcHS,CCTNews,3,Carroll County Times,en
552,2021-02-23 23:33:23+00:00,1364357718560112645,I Cleaned My Room I Ate My Veggies I Visited Salmiac In The Hospital And Gave Him Flowers (He's Still In The Hospital BTW) And I Even Put On My Nice Button-Up Shirt Can I Please Have The Covid Vaccine Pleaseeeee,KingStBee,1,King St. Bee,en
553,2021-02-23 23:33:17+00:00,1364357692786151424,Wow! Regional Health is no longer giving covid vaccines! Lovely.,Kim7834,0,Kim,en
554,2021-02-23 23:33:16+00:00,1364357691875987466,"all very coincidental is it? johnson in 2018 talking about vaccines, his dad writes about a virus, and low and behold a virus arrives in 2019. Covid will be back, it doesnt take a rocket scientist to know this https://t.co/ZKjFGcgENF",ShareZone5,1,Draft,en
555,2021-02-23 23:33:10+00:00,1364357666861178881,"@bridget_joy_ Yes, I believe, it will be beneficial. 
Our yearly flu shots are less effective then the trials of covid vaccines have proven to be. Yet, many of us line up every year to get one.
The mutation of this virus is what's concerning to me. 🙏🏾",CeciliaLisa3033,2,You Can't Make This Stuff Up!,en
556,2021-02-23 23:33:09+00:00,1364357661916090374,"Local health officials will address Bell County’s next distribution stage for COVID-19 vaccines at 1 p.m. Wednesday, Bell County spokesman James Stafford said. https://t.co/nHjRlP6Sg5",tdtnews,0,Temple Daily Telegram,en
557,2021-02-23 23:33:09+00:00,1364357659512692740,OK..I'm starting to smell a rat with these Covid 19 Vaccines..my bullshit detector is kicking in..so they make them like 24 hours a day..like 2 or 3 different companies..but the pharmacist at CVS told me I cant get one yet..because they dont have enough..yea OK asshole.. https://t.co/nDJEVgW1sm,gmugg68,0,Georgie Massachusetts,en
558,2021-02-23 23:33:03+00:00,1364357635370217476,"NBA Legends Get Covid-19 Vaccines, Here Are Their Messages https://t.co/wu0fsiTUXk #health #mhealth",HealthRedapple,0,"Redapple Digital Health, Inc.",en
559,2021-02-23 23:33:03+00:00,1364357635156369409,"@AUfamTN UT can’t require COVID vaccination until full FDA approval is given for the vaccine, under Federal law. https://t.co/VSGTYeDxNS",mck867,3,Mama Kuest,en
560,2021-02-23 23:33:02+00:00,1364357631498809344,Thank you so much @AFARmedia for ALWAYS keeping us informed and travel dreaming.  CAN I TRAVEL AFTER GETTING COVID-19 VACCINE? It’s the question on all our minds…  https://t.co/383bhwJ0QU via @AFARmedia,MeaningfulTrips,0,MeaningfulTrips,en
561,2021-02-23 23:32:56+00:00,1364357604198273027,I get my covid vaccine tomorrow! Just as the CDC pretty much said teachers are the real spreaders 🙄,sarahisfreshh,1,insert name here,en
562,2021-02-23 23:32:50+00:00,1364357583029624832,"The scientists of the world developed a COVID 19 vaccine in record time, the Feds ordered and are now delivering it but @fordnation is not ready to get it in the arms of our seniors. We need the scientists to work on a vaccine for stupidity and incompetency. #onpoli #onted",AllergyParent,2,Kate C,en
563,2021-02-23 23:32:49+00:00,1364357575068643329,Thanks @RepGregStanton. This is info that AZ'ans can use: What you need to know to get the COVID-19 vaccine in Arizona by Rep. Greg Stanton https://t.co/BNpd0hb1cz,MichaelMufasa,2,Michael,en
564,2021-02-23 23:32:46+00:00,1364357563656069120,Doctors Reject Experimental COVID-19 Vaccine https://t.co/saFoBAAMOf,mdfantastic,0,marydebbie,en
565,2021-02-23 23:32:45+00:00,1364357558266339328,"@gavinnewsom PLEASE help to include type 1 #diabetes, an autoimmune illness, in the #COVID-19 vaccination tier for people with chronic conditions. It is unconscionable not to do so. Thank you!

#T1D #diabetes #COVIDVaccine #MyWhy  -AT",DiabetesMine,10,DiabetesMine,en
566,2021-02-23 23:32:45+00:00,1364357558052343808,"Yep the Govt has really planned phase1A.
Two residents in Brisbane aged care facility given 'higher than recommended dose' of COVID-19 Pfizer vaccine
https://t.co/LKHYUSL6Se",suemazzy1,0,suemazzy,en
567,2021-02-23 23:32:39+00:00,1364357534245617666,not my mom convincing my grandpa to not get the covid vaccine rn 😞,jjkstays,0,averey ☁️,en
568,2021-02-23 23:32:39+00:00,1364357533918371842,3% of Canadians have received one or more doses of Covid vaccine. https://t.co/CvjO0O1CNr,bcshaffer,1,Blake Shaffer 📊,en
569,2021-02-23 23:32:37+00:00,1364357525789761536,"Beltway Insider: Biden’s Rescue Plan, Trump, Texas, COVID, Vaccine, Immigration, Khashoggi, MARS https://t.co/WWXCWuHNik",JanetWa94118686,0,thewriterJanet Walker,en
570,2021-02-23 23:32:23+00:00,1364357467120017411,Why is Tennessee so slow in giving covid vaccine @GovBillLee,SandyJLMurdock,0,Sandy💙SAVE VOTING RIGHTS,en
571,2021-02-23 23:32:22+00:00,1364357465475719169,Director of Ambulance Services Andrew Thomas was all smiles yesterday when he got his COVID-19 vaccine...we think! 😷💉 #PfizerVaccine #frontlineworkers #paramedics https://t.co/L1qNoyrjRL,Stjohnnt,1,St John Ambulance Australia NT,en
572,2021-02-23 23:32:15+00:00,1364357435998281729,Also booked in to get my covid vaccine! Very much looking forward to it :),Peachtree_5,7,Peachtree🍑🌳,en
573,2021-02-23 23:32:04+00:00,1364357388443262980,"Starting Wednesday, seniors 65 and older can schedule a COVID-19 vaccine appointment at all CVS y más and Navarro Discount Pharmacies in Miami-Dade County. Several CVS stores across Florida also will have vaccines in stock. https://t.co/l5ovEIeuiD",MiamiHerald,9,Miami Herald,en
