,Datetime,Tweet Id,Text,Username,Like Count,Display Name,Language
184,2021-02-23 23:50:08+00:00,1364361934812958721,Sorting out COVID-19 vaccine chaos in Wayne County   https://t.co/rIZHicVpJy,wxyzdetroit,3,WXYZ Detroit,en
185,2021-02-23 23:50:06+00:00,1364361927565131779,"@ReneeAlida I have heart disease and COPD. I have no idea when I'll be eligible for the vaccine. I have ALL ideas that if I get COVID, I will die.

Fuck Megan McCain",DeborahGreat1,1,Deborah 💥The Great💥,en
186,2021-02-23 23:50:05+00:00,1364361922905210881,@AmerMedicalAssn @MedBoardOfCA  Do tell how a doctor can break into the US Capitol and be arrested and lie to the public about the COVID vaccine and threaten Dr. Fauci and still have her medical license?! #DoBetter  https://t.co/GhchnE5yW3,kdmquito,1,KOregon,en
187,2021-02-23 23:50:02+00:00,1364361910410301442,"Tale of two vaccine roll-outs: COVID-19 numbers plummet in Toronto’s long-term-care homes, while Ontario’s remain ‘stubbornly high’ https://t.co/EYrZUHnqNr",StarGTANews,1,Star GTA,en
188,2021-02-23 23:50:01+00:00,1364361906912325632,"Tale of two vaccine roll-outs: COVID-19 numbers plummet in Toronto’s long-term-care homes, while Ontario’s remain ‘stubbornly high’ https://t.co/TQP9I785ko",TorontoStar,4,Toronto Star,en
189,2021-02-23 23:49:56+00:00,1364361883592105987,I got the covid vaccine and now my arm keeps getting Streetpass notifications,Boneless_pepsi,6,50 mile wide crab,en
190,2021-02-23 23:49:44+00:00,1364361834468417538,Rishi Sunak refuses to say if he will profit from Moderna Covid vaccine | Rishi Sunak | The Guardian https://t.co/5auf2vQVqZ,MarsPioneer,0,Mars Pioneer,en
191,2021-02-23 23:49:44+00:00,1364361832975257605,"I just got an appointment for my first COVID vaccine shot, and I feel like I’ve won the damn lottery! https://t.co/g46PCFfNRi",haleykscissors,10,"Haley Pierson-Cox, Craft Witch of Brooklyn",en
192,2021-02-23 23:49:38+00:00,1364361807775756293,"これが周知されてないために色々とデマも飛び交っているかも「The main reason is simple: the company hasn’t applied for emergency-use authorization yet.」
Other Countries Have Authorized AstraZeneca’s Covid-19 Vaccine—Why Hasn’t The U.S.? https://t.co/uopkVvtnpD",godmother6,0,godmother,ja
193,2021-02-23 23:49:35+00:00,1364361798296629248,"Covid US: 6,994 react badly to vaccines, 9.2% ‘seriously’ https://t.co/XGrI3mlNqA",TodayHeadline42,0,todayheadline,en
194,2021-02-23 23:49:32+00:00,1364361783687974913,I want to see a Covid vaccine commercial like all other drug commercials just to hear how fast that guy talks at the end rattling off all the potential side effects.,ellisdee4u,29,Conspiracy No Evil,en
195,2021-02-23 23:49:31+00:00,1364361778306637826,"More encouraging news on the available COVID-19 vaccines, especially #AstraZeneca: https://t.co/M0iMWXDXgS",268Weather,2,268Weather,en
196,2021-02-23 23:49:30+00:00,1364361775534211074,Not quite. India has developed its own covid vaccine which it has been pushing- that is what has been told to be used as a priority for domestic needs. It still has the contract to produce AstraZ along with S.Korea which will go towards COVAX for the developing world. Most rich https://t.co/MdiQM1XZoL,stbessgirl,1,Irie1🇯🇲,en
197,2021-02-23 23:49:30+00:00,1364361774405804038,Nearly 1-in-5 saying they're unlikely to get the COVID-19 vaccine. 1.5x higher than last May. https://t.co/u5U7TUil0Q,CE_Whelan,0,Colin Whelan,en
198,2021-02-23 23:49:29+00:00,1364361771360739331,"The growing evidence that the COVID-19 vaccines can reduce transmission, explained - Vox https://t.co/VMryKqttge",MaxineSykes,1,maxine sykes,en
199,2021-02-23 23:49:24+00:00,1364361751366541316,Hope we get enough covid vaccines so I don’t end up taking one from someone who needs it more using an exploit online,ICETEP,6,Gabe (he/him),en
200,2021-02-23 23:49:15+00:00,1364361714138034177,"Some kind of ""leader ...""

https://t.co/VYW9Z9NDww

""A number of Canada’s explicit priorities, however — including access to COVID-19 vaccines, freeing Michael Spavor and Michael Kovrig from China or securing an exemption to Buy American — were conspicuously absent.""/1

#cdnpoli",KonservativeKa1,1,KonservativeKatie,en
201,2021-02-23 23:49:15+00:00,1364361710509846535,"@KamVTV So now the Repubs are lining up against the Covid relief bill ( the one that provides a little money to people, helps gets the vaccine distributed, and helps businesses) because .....why?  Oh, because it's a Democratic bill.   Isn't that special?",S23093890,1,S,en
202,2021-02-23 23:49:14+00:00,1364361707053703169,calling the second dose “COVID and the Vaccine: The Squeakquel”,In_The_Mtns,1,Agricolter,en
203,2021-02-23 23:49:13+00:00,1364361704004534277,"Can someone tell me please why I’m adviser to have a vaccine for the flu every year because we are likely to be in a worse state if we get flu but now I’m not deemed clinically vulnerable enough for a COVID vaccine. 

cool cool cool cool cool",chloemxnnxo,0,carl,en
204,2021-02-23 23:49:13+00:00,1364361703031525379,"And if it's on my calendar as ""COVID-19 vaccine"", I still have no idea what we're talking about. https://t.co/DV4wdcdhbJ",abuttenheim,5,Alison Buttenheim,en
205,2021-02-23 23:49:11+00:00,1364361696534401026,"WHO Agrees Compensation Fund For Serious COVAX Vaccine Side Effects https://t.co/jtdeWQJj48

Uncensored COVID-19 News - Website
https://t.co/uGj6J9T0Az

Sunfellow on COVID-19 - Telegram
https://t.co/oab2ynkaRg

#COVID19 #COVID19Pandemic #coronavirus #CoronavirusVaccine",sunfellow,0,sunfellow,en
206,2021-02-23 23:49:11+00:00,1364361694802182144,"TGA bans Pfizer, AstraZeneca brand mentions in COVID-19 vaccine advertising https://t.co/2AiAOF0j79",trollingclaire,0,Paul Dobbie,en
207,2021-02-23 23:49:08+00:00,1364361682047352841,Flowers Hospital nurses administered 400 COVID-19 vaccines to the public in less than three hours Tuesday morning during its one-day clinic. https://t.co/TF6YEPYxZP,dothaneagle,0,Dothan Eagle,en
208,2021-02-23 23:49:07+00:00,1364361678658412545,"In August, millions of farmworkers in the U.S. were recognized as heroes by the Hispanic Heritage Foundation. Five months later, Virginia prioritized them in vaccine eligibility due to high COVID-19 exposure risk that's infected more than 1,300... https://t.co/ajWzjIq09u",CulpeperSE,0,The Star-Exponent,en
209,2021-02-23 23:49:03+00:00,1364361661881208835,Scathing report of Shelby County's wasted COVID-19 vaccines draws ire of local leaders https://t.co/a49IkyLpT5,memphisnews,0,Commercial Appeal,en
210,2021-02-23 23:48:59+00:00,1364361646370676737,"Utterly evil: “The regional government of Galicia in northwestern Spain has announced that the Covid-19 vaccine will be compulsory for all its 2.7 million inhabitants, and that fines for those who don’t follow the rules will go from €1,000 to €60,000.” https://t.co/2zRSpCCJkB",mgscarsbrook,22,Matthew Scarsbrook,en
211,2021-02-23 23:48:58+00:00,1364361642935349248,"New York hotel workers seek COVID-19 vaccine in appeal to Cuomo (New York Post)

They want to check in - for a vaccine.The hotel industry is urging Gov. Andrew Cuomo to designate...

Add your highlights:
https://t.co/Cok6LNxhif
 #NYC #newyork #Newyork...",NewYorkCity_b,0,New York City Briefly,en
212,2021-02-23 23:48:54+00:00,1364361623163527171,Is the governor of Florida playing the quid pro quo card with the covid-19 vaccine $$$ ??,HappyLu84721844,0,🌊🌊🌊🌊🌊 🌊 HAPPY LUCKY,en
213,2021-02-23 23:48:48+00:00,1364361599310520323,@CatherinVaritek Setting up one of my twin 13 year old girls new Mac book pro. She is really struggling with hybrid of remote and in person learning so trying to cheer her up ! Tired of COVID! But on a good note I got my 1st dose of the vaccine today😃,BMWatts17,2,Brian Watts,en
214,2021-02-23 23:48:47+00:00,1364361595384700938,"A local journalist went to a fb group to ask for insight on people’s Covid vaccine experiences and in true red-state fashion.. people had to bombard the post with their personal feelings on Covid, the vaccine and the current POTUS. Does anyone else get really annoyed when",gohomejasmin,2,Jas 🌺,en
215,2021-02-23 23:48:46+00:00,1364361590208798721,"@Cal_OES #COVID-19 #vaccine💉or not yet? You can still help @UCLA @InspirestudyLA understand #coronavirus health effects and #longhauler research. Recent COVID test, age 18+, w/suspected symptoms, and able to complete online surveys &amp; health info. https://t.co/U3vmvFeAs9 #TheRiskIsReal😷",InspirestudyLA,0,INSPIRE Study (COVID-19 Registry) Los Angeles,en
216,2021-02-23 23:48:44+00:00,1364361581409132544,"@bridget_joy_ Would say yes with caveat. It must be almost all, if 45% of the country is playing Covid-19 is fake news, not getting it then we're screwed. Longer it goes on, more variants which may put those having the vaccine at risk again. So how much faith do you have in Americans?",scramblera,6,alertwillrobbins,en
217,2021-02-23 23:48:35+00:00,1364361544121782272,Why are people with type 1 diabetes not able to get their covid vaccine when they are just as vulnerable as type 2? @GovParsonMO make it make sense.,annabelleekay,43,Annabelle Edwards,en
218,2021-02-23 23:48:27+00:00,1364361512123564036,I wonder why the covid vaccine roll out doesn't seem to have a plan.  Haven't we just spent almost 12 months dealing with Covid?  #whatwereudoing,weaverworks,1,Liz Weaver,en
219,2021-02-23 23:48:25+00:00,1364361502853984260,Second COVID-19 vaccine dose brings traffic woes to Montgomery County https://t.co/k27GWUKLg0 via @houstonchron,alanfossler,1,Alan Fossler,en
220,2021-02-23 23:48:24+00:00,1364361499330961408,JCVI: Please Cover All Clinically Vulnerable Asthmatics in Covid Vaccine Groups 1-9 - Sign the Petition! https://t.co/RVC12FH9ZL via @UKChange,Mop732,0,Mop,en
221,2021-02-23 23:48:17+00:00,1364361467785605126,"259 new confirmed Covid-19 cases in NH. 1 new death. 112 currently hospitalized. 36 pediatric cases. 73,923 cases since March 2 and 1155 deaths. 2,728 current cases. The new vaccine website that was supposed to be ready to go has not appeared.   #NHPolitcs #NoLeadership",susanthe,17,susanthe,en
222,2021-02-23 23:48:12+00:00,1364361447204077573,@US_FDA guidance for #COVIDVaccine against variants. Full Phase 3 clinical trials will not be needed. https://t.co/bRH4wfw00F,davin_gill,0,"Davinder Gill, PhD",en
223,2021-02-23 23:48:05+00:00,1364361419869876233,@BibiBaskin Switch the dial away from RTE &amp; any other talk radio! It helps hugely to have any kind of music roar out you rather than endless talk about vaccines &amp; Covid! We’ll get our vaccines in time! ☹️👍,HanlonIta,2,Ita O’Hanlon,en
224,2021-02-23 23:48:03+00:00,1364361411103776770,"PSA: If you are on a waiting list for the #COVIDVaccine, make sure your phone is able to receive calls from unknown numbers and answer every call! #vaccine providers have to move fast. They can’t wait for a callback so they will move on without leaving a message. https://t.co/WzTRUpVsiq",sebrina_doyle,1,Sebrina Doyle Fosco,en
225,2021-02-23 23:48:00+00:00,1364361396717248512,"By mid-to-late May or early June, everyone in the Roanoke Valley may be able to receive the COVID vaccine. https://t.co/ytCbVZPOry",wsls,7,WSLS 10,en
226,2021-02-23 23:47:56+00:00,1364361379365314562,"@jerzyfoss @cheesedoff3 @JimboJo56189694 While I'm waiting for u to answer my question, I'll address yours:

Definition of gene therapy from the FDA: ""manipulate ... the biological properties of living cells for therapeutic use"".

Does the Covid vaccine do this?

Yes. 

CDC: ""they teach our cells how to make a protein"". https://t.co/gJFvW2dm5l",SimonMaxfield8,0,𝐒𝐢𝐦𝐨𝐧 𝐌𝐚𝐱𝐟𝐢𝐞𝐥𝐝,en
227,2021-02-23 23:47:54+00:00,1364361372209876992,"@kazweida And sadly the US is way ahead of most parts of Canada. I can’t see Canada getting totally out of this until December at minimum. There’s no real plans for a vaccine roll out, 1/2 the provinces aren’t taking COVID seriously. It’s a nightmare.",hbicofyourass,2,Pretty sure my virginity has grown back by now,en
228,2021-02-23 23:47:52+00:00,1364361365939437575,"@MaryElizabethRN @JustinCzas @DrEmbrace Covid death rate in U.S. is about 0,5%.. Vaccine death rate only 0,2% &amp; getting infected with covid rate is 0,2%..so totally worth it 👍",QuuSuz,0,👣QuiteExtraordinarius💭,en
229,2021-02-23 23:47:49+00:00,1364361352861597698,"So I finally got a letter today and I'm getting the covid vaccine on Saturday. 💕✨

That does mean there is a chance I will be out of commission for a few days after.

So I'm going to try and stream either Thursday or Friday 💙💙💜💜💜💙💙 https://t.co/FE2dzKtyqY",DScottishSelkie,5,Dee,en
230,2021-02-23 23:47:48+00:00,1364361345961967616,Just got my first dose of my COVID vaccine. ✅💪 https://t.co/mWtk0f9XA1,AshleyHLovesTay,3,"𝑓𝑒𝑎𝑟𝑙𝑒𝑠𝑠𝑙𝑦, 𝐴𝑠ℎ𝑙𝑒𝑦🧣Dream 2 Hug Tay",en
231,2021-02-23 23:47:45+00:00,1364361334536605696,"Today is the day for Muhyiddin, Noor Hisham to receive Covid-19 vaccine. https://t.co/tpH1dQ2hTu",nurse_ot,1,Faris Akmal Bin Razali,en
232,2021-02-23 23:47:38+00:00,1364361307462512644,Mi seguimiento 📡 sobre #eHealth Clover Biopharma adds $230M as Covid-19 vaccine heads to pivotal test: https://t.co/dh37t3OAdn,GhirardiEugenio,0,Eugenio Ghirardi,en
233,2021-02-23 23:47:32+00:00,1364361279343886338,"Experts say that meds (@tylenol @AdvilRelief) should NOT be taken prior to receiving the COVID-19 vaccine as these meds may lessen your body’s immune response to the vaccine. If you develop side effects after vaccination, talk to your doctor. @T_K_OMalley  @UMassMedical  @ABC",DisasterUmass,1,UMass Disaster Med,en
234,2021-02-23 23:47:29+00:00,1364361267612446721,"for those with COVID Vaccine:

What Dr. Fauci is, and is not doing, now that he's fully vaccinated for Covid https://t.co/Elxe3TnAj6",Bearcat_T,0,Bearcat T,en
235,2021-02-23 23:47:25+00:00,1364361250717790209,"Sorry, of course Twitter is not letting me Tweet the video of all the doctors saying Covid-19 is not a medical pandemic and the vaccines are not proven or safe. We are basically guinea pigs. They do not recommend them to their families or patients. Please do your research.",Skirker86,0,Scott Kirker,en
236,2021-02-23 23:47:20+00:00,1364361230887100417,Pharmacists say 'heartbreaking' waste of Covid vaccines has a simple solution https://t.co/vsX5udqKBc via @nbcnews,AnthonyJoyner44,0,Anthony Joyner,en
237,2021-02-23 23:47:14+00:00,1364361206782427142,@sunzets7 vicks is the cure to covid. vaccine got nothing on this one😫🤚🏻,Emelia4567,0,Emelia,en
238,2021-02-23 23:47:08+00:00,1364361180144312320,Everybody excited posting pics about these COVID vaccines but not a soul post when they getting them penicillin shots for VD,Junebuggedout,1,Huey P. Newsom ✊🏾,en
239,2021-02-23 23:47:08+00:00,1364361179578171396,UK Government : People with Asthma should be in Group 6 for Covid-19 vaccine. - Sign the Petition! https://t.co/EOWICepUUl via @UKChange,kjs182,0,K,en
240,2021-02-23 23:47:05+00:00,1364361167800524800,As soon as it is available for me i will be taking the covid vaccine because while i understand old life is probably gone forever i would like to at least go places that have been shutdown for almost a year like a movie theater,grangera04,0,Adam Ross Granger,en
241,2021-02-23 23:47:05+00:00,1364361165564960769,"Clover Raises $230M For Phase II/III Trial of Fusion-Protein COVID-19 Vaccine

Despite the numerous high-efficacy #COVID19 #vaccines, 2nd generation vaccines are moving into Phase II/III #testing like that being developed by Clover $CLV &amp; Dynavax $DVAX

https://t.co/L0jU3HM4z5",invesBrain,4,invesBrain,en
242,2021-02-23 23:47:04+00:00,1364361163111292938,"British Columbians could get their COVID-19 vaccination shot from a dentist at a hockey rink. The pool of ""immunizers"" has been expanded to ensure the quickest possible roll-out of vaccines, Dr. Bonnie Henry said Tuesday. https://t.co/PbIq3kRi05",KelownaCourier,1,The Daily Courier,en
243,2021-02-23 23:47:03+00:00,1364361156773699584,"""On her 100th birthday, Vivian was celebrated with a COVID-19-safe birthday parade.... But it was walking into Overlake Hospital that really gave her reason to celebrate. That’s when she got her second shot of the Pfizer COVID-19 vaccine.""
@KIRO7Seattle https://t.co/2ePySwNG7d",OverlakeHMC,2,Overlake Medical Center & Clinics,en
244,2021-02-23 23:47:01+00:00,1364361151706931200,"@skarlamangla An injection is not the same as a vaccine,  covid never been isolated so it's a lab made injection made w mrna which will modify you dna...doesn't sound safe to me!",LauraRubalcab19,0,Laura Rubalcaba,en
245,2021-02-23 23:47:00+00:00,1364361145071534080,"Two elderly people given four times correct dose of Covid-19 vaccine in Queensland. The 88-year-old man and 94-year-old woman are being monitored but are showing no signs of an adverse reaction.
https://t.co/MLED0QvXvl https://t.co/ybeS6QYa3z",1NewsNZ,7,1News,en
246,2021-02-23 23:46:56+00:00,1364361130412568576,"COVID-19 vaccine manufacturers told lawmakers the U.S. should have enough supply to vaccinate every American who wants the shot by the end of July.

Meanwhile, there are new signs of a gradual return to pre-pandemic life for sports fans.

@NikkiBattiste has the latest https://t.co/kip6fMEvvL",CBSEveningNews,8,CBS Evening News,en
247,2021-02-23 23:46:56+00:00,1364361130093633536,oomfs do people actually take covid seriously in yalls cities? do people willingly wear masks correctly? do ppl want to get the vaccine? /gen,lovingdreamy,0,sash❣️lime,en
248,2021-02-23 23:46:49+00:00,1364361100779782146,"BREAKING: SIDP joined with @NPhAPharmacy to advocate for equitable access and transparency in #COVIDVaccine distribution in minoritized communities 🗣️

Read the press release here: https://t.co/fSTAye08TN
#equity #transparency #IDTwitter https://t.co/7CDoPbwOrC",SIDPharm,29,SIDP,en
249,2021-02-23 23:46:43+00:00,1364361073512521728,Doctor stood down after administering incorrect dose of COVID-19 vaccine to aged care residents - The Age https://t.co/vJTIIz46as,susan_taylor07,0,Susan Taylor,en
250,2021-02-23 23:46:42+00:00,1364361072250003458,"For my WA friends, you can check your eligibility for the COVID-19 vaccine at https://t.co/9kgBeWXB2q 💉",vickyfloresn,4,vickyfloresn.eth (she/her),en
251,2021-02-23 23:46:42+00:00,1364361071570653187,"@jdstafford11 @Sprinter0712 Your comment is ignorant. Mainstream media and government have a captive audience. It isn't just about the vaccine, it's about the entire trajectory and people in the Covid Hypochondriac cult need to see the alternative.",Joel41681269,17,Joel,en
252,2021-02-23 23:46:40+00:00,1364361062578085891,"@CVaccinebot 🇳🇱 Vaccine rollout for the Netherlands 🇳🇱

⬜⬜⬜⬜⬜⬜⬜⬜⬜⬜⬜⬜⬜⬜⬜ 4,82% (estimate)

Number of doses administered: 1.062.871

#COVID19NL #covidanalytics #Vaccination https://t.co/mi8V1X8BdQ",covid_nl,0,🇳🇱 Covid Analytics NL,en
253,2021-02-23 23:46:36+00:00,1364361046539055104,UK thinktank calls for door-to-door Covid jabs to tackle vaccine disparities https://t.co/YeOQ1mU87E,TheFabledAesop,1,Saboteur Aesop 🔵,en
254,2021-02-23 23:46:36+00:00,1364361043460431874,COVID-19 update for Feb. 24: Passengers on quarantine hotels | No word on vaccine registration for over-80's https://t.co/tAtb5TqPRA,theprovince,0,The Province,en
255,2021-02-23 23:46:35+00:00,1364361042944548867,"Our letter to @GovTimWalz shares insights from AARP members about their experience trying to get the #COVIDvaccine &amp; outlines steps the state can take to ensure equitable, accessible, &amp; user-friendly vaccine administration &amp; to continue to prioritize older Minnesotans. #VaxMN",aarpmn,2,AARP Minnesota,en
256,2021-02-23 23:46:32+00:00,1364361030256721922,Part II – Western Capital’s Long Chinese Mission: From Opium to COVID Vaccine Credentials https://t.co/kJ5EHwxeIO,BettyEyes,0,Betty  Pierce,en
257,2021-02-23 23:46:29+00:00,1364361015975157765,"@KymYSmith @SteveWildWolf @MatthewVaughan0 @lewisleonard18 @rosco77471 And that’s why it was said there would possibility be “booster” jabs. The flu vaccine is adapted every year, for new strains and mutations. I would imagine they would do something similar to that for covid. 🤷🏻‍♀️",BethImogen,0,Beth,en
258,2021-02-23 23:46:26+00:00,1364361004281389057,Pregnant women would be a fool to get the covid vaccine. https://t.co/hZmfpomLQr,Marlene_Danko,0,Marlene Danko,en
259,2021-02-23 23:46:20+00:00,1364360980185174018,Number of UK Covid vaccinations falls by a third as vaccine supply dips https://t.co/2jYsyLrBSe,JeanneBartram,1,Jasmine the European Cat,en
260,2021-02-23 23:46:16+00:00,1364360963261145092,".@repstevechabot @senrobportman @SenSherrodBrown Effective vaccines are key to ending the pandemic, but only if the most vulnerable, everywhere, can access them. Congress must invest at least $20bn to fight COVID-19 globally. #ONEPowerSummit https://t.co/nLPLEIuD3g",Cynt622,0,Cynthia Chambers,en
261,2021-02-23 23:46:16+00:00,1364360960903766017,"Anyone get the covid vaccine?

If so, any physical reaction?",gspinell,1,gspinell,en
262,2021-02-23 23:46:12+00:00,1364360943648473090,"In other words, the people most likely to die from COVID got the vaccine first?   That’s insane!   Arrest that man! https://t.co/HUfJp6HKF9",2flippinfun,0,2FlippinFun,en
263,2021-02-23 23:46:07+00:00,1364360922651709441,Have you gotten the COVID Vaccine?,Bekitah,0,bekitahbear,en
264,2021-02-23 23:46:04+00:00,1364360910794600451,Curious about the COVID-19 vaccination progress in California? Check out our online vaccine tracker to learn about the progress of vaccinations and where you can go to get your vaccine. https://t.co/kthT94kuIH,SrCareCenter,0,Senior Care Center,en
265,2021-02-23 23:46:03+00:00,1364360908479291405,"Although many people recover fully from the coronavirus, some report feeling symptoms lasting from weeks to months. COVID-19 is a relatively new virus and we are still learning about it's impact on the body.

https://t.co/218ke6DXWF

#COVID19 #COVID19Ontario #coronavirus #vaccine https://t.co/GgE8iRwjuL",Covid19simple,5,COVID-19 Made Simple,en
266,2021-02-23 23:46:02+00:00,1364360901785251841,"🌏 Global COVID-19 vaccine rollout

⬜⬜⬜⬜⬜⬜⬜⬜⬜⬜⬜⬜⬜⬜⬜ 1.58% (estimate)

Vaccine doses deployed: 212M
The rollout seems to be slowing down

#COVID19 #EpiTwitter #Vaccination #PublicHealth https://t.co/BruSgbBQj8",CVaccinebot,1,covid_vaccinebot,en
267,2021-02-23 23:45:54+00:00,1364360868528611339,BMBC: Baptist Hospital-DeSoto is offering the COVID-19 vaccine to persons 65 years &amp; up &amp; those 16-64 years old with underlying medical conditions who live or work in Mississippi. Appointments are for March 2-4 from 8a - 4p. Call 662-772-4499 between 9a - 4p to schedule your apt. https://t.co/jnhxnn1xDW,NDCCMemphis,0,New Direction Christian Church,en
268,2021-02-23 23:45:51+00:00,1364360858336456712,Move to Single-Dose COVID Vaccine Is Worth a Shot https://t.co/U7bWIqt9r4 a través de @medscape,BIOCIENCIA2013,0,BIOCIENCIA,en
269,2021-02-23 23:45:31+00:00,1364360773825347586,I'm ready for the Covid-19 vaccine,arts_dav,0,Arts,en
270,2021-02-23 23:45:30+00:00,1364360768733515783,📷 Just got my first dose of my COVID vaccine. ✅💪 https://t.co/xXUsxLFySx https://t.co/Z393xf1ndK,AshleyHLovesTay,0,"𝑓𝑒𝑎𝑟𝑙𝑒𝑠𝑠𝑙𝑦, 𝐴𝑠ℎ𝑙𝑒𝑦🧣Dream 2 Hug Tay",en
271,2021-02-23 23:45:29+00:00,1364360762861510658,Just got my first dose of my COVID vaccine. ✅💪 https://t.co/T1KIdvrQm0,AshleyHLovesTay,1,"𝑓𝑒𝑎𝑟𝑙𝑒𝑠𝑠𝑙𝑦, 𝐴𝑠ℎ𝑙𝑒𝑦🧣Dream 2 Hug Tay",en
272,2021-02-23 23:45:19+00:00,1364360722751184898,"Shoutout to states prioritizing teachers for COVID vaccines.

https://t.co/iREzi5f3N4",yargergal,5,Erica Yarger 📸,en
273,2021-02-23 23:45:18+00:00,1364360718326374400,Number of UK Covid vaccinations falls by a third as vaccine supply dips https://t.co/fd76Csgyp0,Johnfrededdy,0,"John Edwards #FBPE,FBR #Progressive Alliance, 3.5%",en
274,2021-02-23 23:45:16+00:00,1364360708876623874,When can you register for the COVID vaccine in CT? https://t.co/ACexDzW4hu via @ConnPost,blockhart1,1,Brian Lockhart,en
275,2021-02-23 23:45:15+00:00,1364360706259226626,second covid vaccine done😌,uwamuwah,13,Vy 🌸,en
276,2021-02-23 23:45:12+00:00,1364360691461816323,"In 1947 New York City vaccinated 5 million people against Smallpox in 2 WEEKS 👏

74 years later it will take Ireland almost  a YEAR to vaccinate a similar number for Covid 😳

Progress? 🤔 #COVID19 #Vaccine #livingwithcovid #COVID19ireland 

https://t.co/v5flaRc6xr",Planetwaves20,3,Vincent,en
277,2021-02-23 23:45:10+00:00,1364360683912007680,"とりあえず、２回接種やろ？
　
#新型コロナウイルス
#ワクチン接種

Pfizer-BioNTech COVID-19 Vaccine Information | CDC https://t.co/lnDVh5tZmg @CDCgovから",fjwr1986nekos,0,fjwr1986nekos,ja
278,2021-02-23 23:45:06+00:00,1364360668904849408,"As of February 21, 2021, around 63.1 million COVID-19 vaccine doses had been administered in the United States. Have you been vaccinated yet? #COVID19
Source: Statista https://t.co/RbKdXzM2ub",ViveraPharma,0,Vivera Pharmaceuticals,en
279,2021-02-23 23:45:06+00:00,1364360667495624706,"We're proud to support citywide efforts to vaccinate the public, like last week's COVID-19 vaccine clinic hosted outside Van Asselt Community Center that was managed by the Somali Health Board, Othello Pharmacy, &amp; others for the SE Seattle community. 
https://t.co/VqpRjIfOXN https://t.co/zMWOjRjAzv",SeattleParks,7,Seattle Parks,en
280,2021-02-23 23:45:06+00:00,1364360666014973956,COVID-19 vaccine makers tell Congress U.S. supply will surge soon https://t.co/O4Md93JZRD https://t.co/r1pLZDW4fm,Reuters,104,Reuters,en
